1077151285420,Ortega-Compton,"ст. Красноуфимск, алл. Герцена, д. 8, 296509",2797,April
5073859821932,Wheeler-Pratt,"к. Кедровый, пер. Тульский, д. 306, 624348",1682,Schulden
1065862819990,"Morgan, Marshall and Huffman","к. Сызрань, пр. Алтайский, д. 8 стр. 1, 416248",2402,
5044612132021,Erickson Inc,"д. Оленек, алл. Нахимова, д. 8/7 стр. 609, 544819",996,
1018916243940,Salazar PLC,"к. Железногорск(Курск.), ш. Дальнее, д. 5/5 стр. 1, 244272",303,Acura
5200133039662,Park Ltd,"д. Анива, ул. Железнодорожная, д. 89 стр. 876, 112178",2935,Stad
1015786218359,Burns Ltd,"п. Омск, пер. Жданова, д. 5/1, 322073",351,Advocaat
5030912595291,Liu-Lucas,"д. Сергиев Посад, алл. Карбышева, д. 1, 884239",1606,Wapens
1098923457973,Mccormick Inc,"ст. Кулунда, ш. Заливное, д. 8/8 стр. 9, 199791",828,
1091926245520,Ruiz LLC,"г. Соловки, ул. Овражная, д. 6/1 к. 771, 247792",2664,Ziekenhuis
5200481284548,Little PLC,"к. Югорск, наб. Ростовская, д. 2/9, 186068",1070,
1036595425338,Nelson-Thomas,"д. Северобайкальск, алл. Высоцкого, д. 1/9 к. 6/6, 322179",668,
5218453712802,"Byrd, Mcdonald and Kim","п. Стрежевой, алл. Заозерная, д. 1 к. 36, 287252",2586,
1023040949580,Vaughan-Williams,"г. Новгород Великий, бул. Ленинградский, д. 6 к. 9/2, 321869",2134,
5102794635158,Davis-Wright,"г. Кашхатау, пр. ДОС, д. 652, 299791",201,Verbroken
1155592942537,"Perez, Manning and Goodman","клх Россошь, наб. Заозерная, д. 3/6 стр. 92, 771941",2205,
5123120523191,Joseph PLC,"д. Елатьма, пр. Курчатова, д. 39 стр. 4/8, 399574",1169,
1052130672032,"Dougherty, Smith and Garcia","ст. Курганинск, пр. Тельмана, д. 795 к. 2/3, 835275",2971,Twintig
5221274407932,Garcia-Lewis,"ст. Липецк, бул. Российский, д. 4/9 стр. 17, 713299",1494,
1153758068200,"Wilson, Ramirez and Gray","г. Серебряные Пруды, бул. Крупской, д. 642 к. 4/4, 619587",367,Hij
5142873166772,Lester-Francis,"к. Воскресенск, пр. Юбилейный, д. 90 стр. 6/9, 836941",2027,By
5082637622359,Peters and Sons,"п. Казань, пр. Станиславского, д. 8, 819468",2454,
5194929119171,Cameron LLC,"д. Кашира, ш. Суворова, д. 130 стр. 868, 044626",239,Kwart
5227702825587,"Jones, Becker and Snyder","г. Пермь, ш. Боровое, д. 70 к. 7/6, 726849",1383,
5084822083605,Parker LLC,"ст. Бирск, бул. Николаева, д. 9 к. 9, 736100",682,
5086813422548,Gonzales-Perez,"с. Хабаровск, пр. Озерный, д. 308, 607617",1598,
5224660488366,Golden Inc,"к. Октябрьское (Челяб.), бул. Жуковского, д. 2/1, 878132",2798,Bestand
1203273743364,Lewis Group,"д. Устюжна, ул. Гаражная, д. 9 стр. 9/8, 363671",856,Nieuwste
1066517199814,Torres-Smith,"д. Томск, наб. Приморская, д. 4, 615370",1592,
1091519984280,Henderson-Gonzalez,"г. Слюдянка, ш. Пушкинское, д. 686, 649420",2119,
5185469585967,Stevenson-Doyle,"д. Морозовск, пр. Розы Люксембург, д. 4, 257021",188,
1043130145431,Gonzalez-Porter,"п. Орехово-Зуево, пер. Промышленный, д. 8, 712508",243,Verdwijnt
1094688260260,Kim-Wilson,"г. Сеймчан, пр. Беляева, д. 3, 275118",1483,Aanbieden
1208907770884,Barnett PLC,"клх Верхний Уфалей, пер. Промышленный, д. 2/1, 813709",1314,
5091792298307,"Roberts, Le and Lee","г. Хатанга, ул. Верхняя, д. 5/1 к. 92, 872795",2390,Behandeld
1183143068360,Jones-Leonard,"п. Кашхатау, пр. Снежный, д. 3/6, 210799",2320,
5011558185062,Rose-Myers,"к. Оймякон, пер. Парижской Коммуны, д. 345 к. 836, 656255",2994,
5120407201954,Malone-Martinez,"клх Семлячики, ул. Брянская, д. 8/3 к. 119, 610914",916,Ram
5012239517296,Gardner-Hughes,"г. Чулым, бул. Поперечный, д. 898, 205091",212,
1229139750157,"Yang, Williams and Price","д. Дно, бул. Казанский, д. 3/2 к. 19, 279602",318,Ronde
1015783134564,Schneider Inc,"клх Россошь, ш. Проезжее, д. 41, 164843",477,
5036302883557,"Pineda, Lopez and Gonzalez","к. Калачинск, алл. Локомотивная, д. 7, 363864",911,
1112341599523,Rogers PLC,"ст. Кандалакша, ш. Невского, д. 310 стр. 28, 293558",2785,Stoere
5108242633351,Lewis PLC,"клх Майкоп, пр. Новый, д. 39 к. 44, 791038",1442,
1082733845094,Chapman-Jones,"г. Новая Игирма, ш. Производственное, д. 29, 490558",1389,Spuit
1090660614439,"Morgan, Williams and Lopez","п. Каменск-Шахтинский, бул. Гражданский, д. 121, 745873",2379,Omgekomen
1046679086046,Barrett and Sons,"ст. Ноябрьск, ул. Одесская, д. 2/4 к. 5, 075008",859,Drink
5212216396959,Chan-Garcia,"д. Борзя, алл. Кузнецова, д. 1 к. 1/9, 087052",954,
1142370025489,"Phillips, Gonzalez and Joseph","с. Агинское (Забайк.), алл. Заливная, д. 9 к. 1, 995811",42,Geslapen
1068797728317,Wade-Pearson,"с. Шерегеш, пер. Гражданский, д. 819, 688442",1281,Wandelen
1143160845046,"Rodriguez, Lewis and Howell","г. Бугуруслан, бул. Полтавский, д. 6/6 к. 9, 594763",2405,
1201559722539,Herrera-Stephenson,"п. Славянск-на-Кубани, ш. Огородное, д. 8, 416583",1566,
5055692521891,Miller LLC,"п. Карталы, ул. Курортная, д. 1/2 к. 75, 578847",2443,Jenny
5215455507680,"Munoz, Williams and Preston","ст. Абакан, пр. Прохладный, д. 3, 211306",385,
5135176675464,Moore-Lee,"с. Каневская, ш. Малиновое, д. 921, 548947",1055,Vastgebonden
5065011685910,"Owens, Black and Hines","г. Энгельс, пер. Песочный, д. 6, 182255",2734,Washington
5203927805868,"Chang, Riley and Harvey","д. Мостовской, ш. Шевченко, д. 2 к. 31, 796208",233,
5054745004144,Barnett-Gutierrez,"д. Нижнекамск, ул. Горная, д. 602 стр. 81, 481377",86,Spiegel
5178238885699,Hendricks-Silva,"с. Томск, алл. Ленина, д. 70, 092244",2458,
1198703341044,Dixon Inc,"к. Токма, алл. Проточная, д. 5 стр. 38, 714959",614,Waardoor
1049118332009,Williams-Hunter,"п. Сибай, бул. Овражный, д. 9/8, 597349",2083,
5028863949868,"Harris, Burton and Koch","ст. Обоянь, ул. Шишкина, д. 8/6 к. 7/5, 677533",1581,Travis
1158362702068,Grant-Phelps,"с. Кущевская, алл. Глинки, д. 7/4 к. 63, 630019",1689,
5155742235150,Sims-Chen,"г. Дудинка, наб. Новосельская, д. 143 к. 3, 520140",750,
5163136245520,"Hill, Hughes and Thompson","клх Курганинск, ул. Учительская, д. 1/8 к. 7/8, 095895",2965,Zoiets
5166906996537,"Moore, Lynn and Jackson","г. Юрюзань, пр. Пушкинский, д. 3/3, 796324",1191,
1047814980091,Smith and Sons,"д. Воскресенск, алл. Камская, д. 7/6, 004988",2214,
5107071276769,Edwards PLC,"д. Можга, алл. Толстого, д. 71 стр. 444, 255716",1225,Zesde
1192212756229,Mason-Garcia,"д. Губкин, наб. Маяковского, д. 7/5 к. 181, 404336",2406,
5045972565315,Rich Inc,"д. Долинск, бул. Тамбовский, д. 1 стр. 9/9, 380749",2409,Pijp
1033901071401,"Perez, Martinez and Hawkins","д. Руза, алл. Советская, д. 183 стр. 578, 404335",2636,Zegt
1053826539854,Brandt Inc,"п. Карабудахкент, ш. Сплавное, д. 96 к. 8/1, 064286",1005,
5035758930191,Williams Ltd,"ст. Нерчинск, алл. Красноармейская, д. 3, 162363",785,Broeders
1062791838119,"Jackson, Grimes and Jones","д. Переславль-Залесский, алл. Социалистическая, д. 54 стр. 6, 812984",317,
5198982629951,"Thomas, Adams and Cooper","ст. Советский, пер. ДОС, д. 8/7 к. 844, 243144",1825,Misselijk
1225807520960,Garcia-Jimenez,"к. Сорочинск, наб. Ставропольская, д. 4 к. 6/5, 062098",1292,
1033729547114,Caldwell-Griffith,"клх Бавлы, бул. Детский, д. 574 к. 123, 946858",1434,Opa
1068416840007,Roth-Wilson,"д. Ульяновск, ш. Челюскинцев, д. 6, 997894",1585,
5037313252213,Washington-Shaw,"ст. Златоуст, наб. Жданова, д. 59 к. 9, 495156",1728,Geloven
5164015599721,"Bridges, Escobar and Fernandez","ст. Сунтар, бул. Полярный, д. 3 стр. 42, 539334",1309,Ontkennen
5059081338465,"Tapia, Johnson and Gray","п. Красноселькуп, алл. Матросова, д. 165, 518921",987,Misselijk
1057180909664,"Santos, Jackson and Weber","г. Киржач, ш. Карла Либкнехта, д. 1/5 стр. 453, 166273",2488,Honger
1154359610151,Webb Inc,"клх Уренгой, наб. Отрадная, д. 5/6 стр. 90, 403899",1145,
5042243474807,Simpson Group,"клх Бугуруслан, наб. Чернышевского, д. 6, 054229",1539,Muur
1037433053800,Jenkins Inc,"д. Игарка, ш. Лазо, д. 3/9 к. 650, 304011",2674,
1227522594936,"Freeman, Brown and Moore","г. Старый Оскол, ш. Белинского, д. 81 к. 5, 477079",794,
5127056423324,Sims-Dennis,"к. Калуга, алл. Сиреневая, д. 9/6 к. 30, 338814",617,Munt
1134044295230,Hall and Sons,"ст. Тулпан, ш. Томское, д. 182 к. 3, 317727",2348,Opeten
1085192121112,Kirk-Everett,"к. Абинск, ш. Надежды, д. 16 стр. 292, 671512",888,
1108738953355,Carter Inc,"ст. Диксон, алл. Гражданская, д. 622 к. 819, 219601",829,
1131047107190,Johnson PLC,"клх Цимлянск, ш. Шолохова, д. 698 стр. 4, 842441",1109,Lagen
1096470360084,Gibbs-Scott,"п. Красноярск, алл. Урицкого, д. 7/2 стр. 4/7, 211749",1467,Aangevallen
5183693394088,Buckley-Thomas,"к. Дубна, пр. Орловский, д. 276 стр. 2/5, 742570",2468,
5092778857551,Walters PLC,"п. Аша, алл. Боровая, д. 537 к. 4/6, 754444",851,Jay
1167331433532,Le PLC,"г. Елатьма, бул. Курчатова, д. 76 к. 838, 034433",1173,Rij
5128754197534,Lopez Ltd,"д. Морозовск, бул. Тукая, д. 81 к. 96, 318959",1877,Zware
1091767589693,Jenkins and Sons,"г. Воткинск, ул. Павлика Морозова, д. 2/2, 517231",2767,Veroorzaakt
5067627572205,"Harrington, Morrow and Hansen","г. Белорецк, ш. Северное, д. 2/2 стр. 417, 287506",999,
1138523917993,Torres-Zamora,"д. Когалым, пр. 8 Марта, д. 349, 587967",371,Ronde
1063877315512,White Ltd,"клх Мостовской, ул. Народная, д. 853 к. 4, 817905",557,Kleintje
1058607190289,Jackson-Williamson,"г. Петропавловск-Камчатский, бул. Нагорный, д. 1/2 стр. 42, 556778",1970,Gates
5206853364471,Booker PLC,"к. Шатой, алл. Светлая, д. 653, 744722",1903,
1032453464658,Hernandez Ltd,"г. Наро-Фоминск, бул. Поперечный, д. 6/9, 917931",2492,Geluid
1198800367237,Lynch-Clay,"ст. Курумкан, бул. Кутузова, д. 5/1 к. 2/9, 788888",475,
5046917181053,Thompson-Chan,"к. Лысьва, пер. Розы Люксембург, д. 5, 965711",663,
1107696546209,Martin PLC,"клх Октябрьский (Башк.), наб. Ватутина, д. 2/4 стр. 41, 256727",2955,Kamers
5018172843882,Garza Inc,"с. Теберда, ш. Каштановое, д. 5, 925054",2867,Kilo
1120569088914,Wang-Cantu,"г. Грозный, пер. Вишневый, д. 36, 071677",2144,Gat
1191319424890,"Lewis, Hunter and Adams","г. Рославль, бул. Коммунаров, д. 5/1, 033260",1737,Vielen
1211889951943,"Johnson, Gay and Ford","к. Кашхатау, алл. Менделеева, д. 9 стр. 832, 257875",2202,
5196294810938,Ramirez-Johnson,"клх Рыбинск, наб. Гафури, д. 433 к. 5, 383701",2673,Staten
5019178768736,"Copeland, Vaughn and Evans","с. Югорск, наб. Производственная, д. 4 к. 5/5, 700958",258,Haalt
5224310366891,Collins and Sons,"п. Ревда (Сверд.), ш. Макарова, д. 50, 902635",827,Knal
5098888185721,Short-Chen,"с. Кыштым, наб. Энергетиков, д. 1 к. 7, 019510",2715,Gezet
5078082212852,Kirby PLC,"к. Анива, пер. Рабочий, д. 9/8 к. 55, 094430",1241,Burgemeester
5013613590260,Diaz-Cunningham,"г. Моздок, ул. Разина, д. 31 к. 7/3, 250022",1815,
5063746667683,Smith PLC,"с. Киров (Вятка), пер. Курортный, д. 126, 024186",763,Leuk
5155220579971,Garrett-Grant,"п. Пушкино (Моск.), пр. Новостройка, д. 447, 569745",362,
1202485189378,"Ryan, Walton and Morris","к. Чебоксары, бул. Линейный, д. 78 к. 99, 297754",1325,Spoor
1060382064533,Brock Group,"к. Аша, ш. Киевское, д. 4, 685211",1911,
5157625994675,Wilson Ltd,"с. Ербогачен, бул. Щетинкина, д. 3/2 стр. 913, 315939",2398,Karen
5166143674186,Farmer and Sons,"г. Тында, пр. Крымский, д. 127, 081209",948,Zegt
1139035484125,Sloan-Castro,"клх Сасово, алл. Гоголя, д. 3/1, 793844",231,Wodka
1051502992254,Williams-Collins,"д. Шатой, ш. Щербакова, д. 81, 306311",2716,
5036594929180,Martinez Ltd,"ст. Ардон, алл. Короленко, д. 576 к. 32, 846788",1204,
1065952344281,Cantu-Nguyen,"с. Канск, пер. Украинский, д. 36 к. 48, 436980",2800,
5033588797930,"Smith, Sandoval and Davis","п. Домбай, ул. Кавказская, д. 7 стр. 29, 242746",202,
5125042911868,Adams-Daniels,"ст. Двинской, бул. Ореховый, д. 67 стр. 52, 565060",189,Daaraan
5200355915282,"Avery, James and Cervantes","г. Владикавказ, пер. Ульяновский, д. 780 к. 8/7, 553791",1629,
1118593135231,"Leonard, Hoffman and Stewart","г. Белоярский, алл. Кавказская, д. 90 к. 9/2, 204824",1985,Verdiend
1192291133650,"Mayo, Kelley and Kaufman","клх Москва, МГУ, бул. Подстанция, д. 55 стр. 8, 990304",2112,
5147815188252,Cardenas Inc,"клх Томпа, пер. Трактовый, д. 892 к. 6, 692904",377,
5207033323613,Melendez Inc,"п. Хасавюрт, ш. Мирное, д. 6/5 стр. 16, 286085",2907,
5122688584948,"Petersen, Padilla and Mitchell","с. Карабудахкент, алл. Нагорная, д. 9, 243568",2109,
1035821565537,Wilson-Williams,"с. Касимов, пр. Огородный, д. 72 стр. 7/9, 279271",2262,
1107019673804,Allen-Rowe,"клх Аргаяш, бул. Приозерный, д. 22, 025566",1457,Pijp
5163001728368,"Peterson, Smith and Manning","г. Красная Поляна, ул. Бабушкина, д. 55 стр. 6/9, 425915",210,Verdwenen
1082868771919,Carter-Barber,"ст. Стерлитамак, наб. Геологов, д. 271 к. 2, 547757",1711,
1186282133982,Austin-Leon,"д. Карабудахкент, бул. Рыбацкий, д. 98 к. 608, 497095",751,
5118456790898,"Simon, Morgan and Reeves","п. Вендинга, ш. Интернациональное, д. 8/8 к. 680, 882265",423,
1219186899172,"Matthews, Woods and Ramos","п. Невьянск, ш. Пугачева, д. 6/7 стр. 13, 009419",1111,
5173949757427,Smith Inc,"д. Шатой, ш. Краснодарское, д. 4 стр. 1/9, 519802",386,Gesteld
5159193002018,Strong PLC,"клх Владимир, пр. Кузнецкий, д. 92 стр. 304, 801106",1908,
1015181158365,"Thomas, Cox and Mendez","клх Волхов, бул. Советов, д. 25, 538930",2288,
5200336837751,Ibarra-Harris,"ст. Новый Уренгой, ш. Большевистское, д. 7/3, 436239",2399,Jaar
1064827319468,Morton and Sons,"ст. Чита, ш. Володарского, д. 6 стр. 9, 257094",2237,
1160989051695,Conner-Morgan,"с. Котельнич, бул. Рабочий, д. 2/4 к. 739, 775506",2742,
5101797972161,"Abbott, Wilson and Davidson","ст. Кизилюрт, наб. Горная, д. 888, 107126",2055,
1096435856021,Peters-Sandoval,"к. Жиганск, бул. Ветеранов, д. 235 стр. 22, 350130",2813,
5014310386250,Simmons-Flores,"г. Бугульма, пер. Толбухина, д. 3 стр. 1/1, 585733",886,
1200266171852,"Carroll, Mcgee and Flores","клх Дагомыс, пер. Химиков, д. 61, 509320",1591,Ademen
1023218933418,"Carlson, Rodriguez and Leonard","д. Черусти, пр. Набережный, д. 7/3 к. 8, 787233",1429,Ambassade
1033854594916,"Jones, Hernandez and Reed","клх Каменномостский, ш. Школьное, д. 7 к. 6/3, 946099",2678,
1196134690674,Henry Ltd,"п. Домодедово, пр. Загородный, д. 650 к. 54, 053849",1991,
5071768053495,"Shaw, Anderson and Farmer","д. Кинешма, бул. Ленинский, д. 5 к. 99, 996287",683,Shrek
5171071077084,"Mendez, Steele and Brown","д. Бологое, пр. Ветеранов, д. 9/4 стр. 2/4, 226926",41,Leiding
5137590313284,"Schwartz, Calhoun and Mitchell","к. Озеры, алл. Ульяновская, д. 6/3 к. 8, 691677",2461,Voorkant
1012933653556,Carson-Osborn,"к. Внуково (метеост.), бул. Хуторской, д. 83 к. 7/5, 305000",527,Lach
1158940032866,Hansen Ltd,"с. Мыс Шмидта, наб. Новая, д. 259 к. 2, 218744",2699,
5175361683932,Thompson-Gilbert,"п. Верещагино (Перм.), пер. Высокий, д. 8/9, 696364",2633,
1082514955159,Adams Ltd,"с. Урай, наб. Кирова, д. 18 стр. 2, 041136",1899,
5209037893378,Jenkins Inc,"к. Минеральные Воды, ш. Лазурное, д. 971, 837529",802,
1186799759860,Morgan-Evans,"п. Владимир, алл. Льва Толстого, д. 60, 928497",2430,Fort
1098013904856,"Dean, Best and Munoz","к. Карталы, наб. Каштановая, д. 62 стр. 372, 433902",99,Held
5081696050080,Hall-Rogers,"п. Ясный (Оренб.), ул. Придорожная, д. 36, 829920",2862,
1021293982357,"Anderson, Lopez and Hahn","ст. Кимры, наб. 30 лет Победы, д. 561 к. 47, 843672",2801,Alleen
5017948514788,"Lara, Jones and George","с. Мыс Шмидта, пер. Тукая, д. 8, 616348",3,
1153462526667,Palmer Inc,"ст. Калачинск, бул. Болотный, д. 4/4 стр. 3/2, 135391",349,Lach
5203483301665,Reese LLC,"клх Ноябрьск, пер. Большой, д. 935 стр. 1/1, 441825",1552,
5053295345934,"Arias, Walker and Compton","п. Плесецк, пер. Рабочий, д. 54 стр. 8, 288783",1714,Audi
5157625253539,Allison and Sons,"к. Ессентуки, пр. Отрадный, д. 859 стр. 13, 058410",218,Verwijderd
1120313523395,"Carpenter, Williams and Smith","п. Якутск, ш. Серафимовича, д. 270 к. 7/8, 688921",33,
5050133684112,Gentry-Moran,"с. Биробиджан, бул. Семашко, д. 783 к. 7/3, 681905",1573,
1066469664458,Gonzalez-Hansen,"п. Хасан, ш. Коммунальное, д. 8 к. 1/7, 140876",704,Arrest
5043378546118,Peterson-Jones,"ст. Охотск, пр. Алтайский, д. 1, 561640",1468,Verwacht
1201754003472,"Smith, Day and Williamson","г. Юровск, ул. Степана Разина, д. 3/5 стр. 5/6, 319798",1278,Apparatuur
5108906132242,Guzman Inc,"клх Хатанга, алл. Свободная, д. 94, 423406",1001,Spider
5082462070741,Mullen Ltd,"ст. Лодейное Поле, наб. 70 лет Октября, д. 58, 823471",2779,Kate
1097915885253,Ray Inc,"п. Томари, ш. Просторное, д. 7/7 к. 39, 220166",1886,Route
1121931937808,"Gonzalez, Reed and Vaughn","ст. Усмань, ш. Береговое, д. 4 стр. 4/8, 941257",2560,Citroen
1227037943098,"Wright, Watts and Lopez","г. Пенза, алл. Санаторная, д. 76 стр. 8, 874719",2726,Paniek
5063776736084,Hill-Myers,"г. Соликамск, ул. Тургенева, д. 1/1 к. 1/3, 154310",1130,
5112973795150,Castro Ltd,"д. Мончегорск, пр. Луначарского, д. 4 к. 1, 768659",257,
1163257533120,"Hayes, Torres and Hogan","с. Кырен, бул. Хуторской, д. 92 стр. 2/3, 510880",2781,
5186861060513,Morse and Sons,"ст. Ульяновск, наб. Ленская, д. 9, 583763",2020,
5063226294830,"Prince, Warren and Haynes","г. Котельнич, ш. Малое, д. 57, 254000",2179,Dodelijke
5093047805318,Davis-Turner,"с. Переславль-Залесский, ш. Тупиковое, д. 198 к. 48, 358880",1948,Nieuwsgierig
1023899332258,"Carlson, Martin and Costa","к. Минусинск, ш. Братское, д. 5/3 к. 24, 058405",1052,Reserve
1012804735921,Nelson-Morales,"клх Цимлянск, алл. Кирпичная, д. 9, 457599",1202,Jess
5165844299946,Anderson PLC,"г. Магнитогорск, ул. Центральная, д. 59 стр. 2/2, 412764",1152,Leef
1141750346044,Reilly-Haynes,"к. Черкесск, алл. Озерная, д. 21, 654655",220,Ring
5145499879267,Shepherd-Mercado,"с. Волгоград, ш. Строительное, д. 1 к. 669, 272953",1180,Wegging
5138965514090,"Hernandez, Boone and Stark","клх Апрелевка, алл. Нахимова, д. 47 стр. 1, 882776",1350,Hekel
5135401147470,"Hayes, Wilkinson and Ibarra","к. Санкт-Петербург, алл. Новосельская, д. 18 стр. 23, 891181",927,Bud
5156298915405,Jones Ltd,"с. Тында, бул. Лесхозный, д. 51, 947149",115,Jacht
1162472892691,Vasquez-Chan,"клх Певек, пер. Белорусский, д. 27, 742810",1183,Moedig
1101568688022,Butler Ltd,"ст. Черусти, пр. Клубный, д. 432 стр. 35, 120409",26,Radar
1051784618038,"Mercer, Hernandez and Avery","г. Соболево, бул. Вавилова, д. 94 стр. 43, 751224",2418,Alleen
5013793029190,"Hoover, Higgins and Barnett","клх Миллерово, наб. Октябрьская, д. 9/7 к. 193, 224723",1964,
1175286425049,Cline-Howard,"д. Камышин, алл. Коммунальная, д. 3, 351126",1973,Ziet
1090769342971,Dixon-Scott,"д. Оймякон, алл. Лесозаводская, д. 53 к. 5/7, 971554",2129,Ketting
5055808832130,Peterson Inc,"с. Кудымкар, наб. Ивановская, д. 6/9 стр. 3, 053695",497,
5055520271340,"Dunlap, Barber and Barber","к. Шереметьево, ш. Локомотивное, д. 30 стр. 4, 581354",28,Dagelijks
5048491854175,Lang-Gordon,"к. Новая Игирма, ул. Розы Люксембург, д. 5/5 к. 11, 957357",2983,
5021683875703,Carter Inc,"ст. Тутончаны, ш. Центральное, д. 27, 129954",459,Gaven
5171229187366,Hughes Group,"г. Красноселькуп, наб. Стадионная, д. 6/9 стр. 50, 403488",2752,
5109207144734,Rodgers-Vega,"с. Лабинск, пер. Гастелло, д. 3/1 стр. 5/9, 263717",1529,
5178224871941,"Greer, Allen and Davis","клх Завьялиха, пер. Песчаный, д. 2 к. 54, 617704",893,Controleer
5141084361666,"Morris, Howard and Rivera","ст. Верхнее Пенжино, пр. 60 лет СССР, д. 7/9, 587948",2453,
1204487933187,Baird Ltd,"клх Ржев, ш. К.Маркса, д. 5 стр. 2/7, 459833",2722,
5026720393520,"Martin, Bell and Trevino","клх Новгород Великий, пр. Морозова, д. 10 стр. 3, 077334",2168,Paard
5128502547377,"Stewart, Mcknight and Gordon","ст. Углич, ш. Беляева, д. 6 к. 9/6, 644105",2392,
1144821680948,Burton-Hensley,"п. Ноглики, ш. Мирное, д. 7 стр. 15, 930032",894,
5051082682085,Hudson-Fields,"к. Оймякон, ул. Мостовая, д. 374, 159452",1547,
5066074185150,Brown Group,"клх Якутск, ул. Ударная, д. 7, 148285",278,Egoïstisch
5013729895647,Zimmerman LLC,"клх Буденновск, пер. Менделеева, д. 1/4, 831799",845,Verkeerd
1047627400611,Reed-Wells,"г. Челюскин, пер. Механический, д. 796 к. 5/1, 241327",96,
1181660756793,Bryant-White,"к. Архангельск, ш. Снежное, д. 991, 753028",718,
5063513811499,Sanders Group,"с. Осташков, ш. Кошевого, д. 544, 107989",368,Vals
1055374344937,"Brown, Sheppard and Miller","к. Обнинск, пер. Новгородский, д. 2/3 стр. 53, 474481",1233,Hebben
1156342598411,"Hicks, Powell and Carpenter","п. Ардон, пер. 40 лет Победы, д. 5 к. 3, 744798",149,
1046155755260,Guerra-Hall,"п. Усть-Джегута, пр. Радищева, д. 98 к. 8, 449682",734,
1103621579588,"Velazquez, Johnson and Green","клх Домодедово, пр. Краснознаменный, д. 9 стр. 82, 065793",554,
5124560356894,Gonzales Inc,"д. Москва, ул. Механизаторов, д. 28, 301526",2846,
5186779379672,"Tran, Ayala and Cowan","ст. Малгобек, ул. Свободы, д. 9, 576888",1349,
5071189651430,Rogers Group,"с. Рославль, пер. Троицкий, д. 83, 007594",1197,Vermijden
