1051292729124,Myers Inc,"к. Радужный, алл. Северная, д. 3/7, 989442",702,
5032192568865,"Gutierrez, Hill and Smith","г. Екатеринбург, алл. Толстого, д. 14 к. 48, 067823",2088,
1137731241570,"Smith, Barnett and Farmer","г. Кировск (Ленин.), пер. Чайковского, д. 858 к. 2, 831467",2330,
1155132460999,Miller-Anderson,"д. Новороссийск, пер. Журавлева, д. 543, 605740",9,
1164989725581,Reed Inc,"с. Верхний Тагил, пр. Ягодный, д. 3/3 к. 7, 522628",1490,
1183755998293,Atkins Inc,"клх Зеленогорск (Ленин.), бул. Песочный, д. 212, 159717",2559,Daewoo
5156442020180,"Hudson, Lewis and Smith","с. Кабанск, ул. Герцена, д. 3/3 к. 5/6, 157234",532,Gemene
1112613101985,"Gardner, Anderson and Newman","ст. Екатеринбург, пер. Кубанский, д. 7/5 к. 763, 530822",2741,Moeras
1214406255414,Bryant LLC,"с. Тулун, пер. Путейский, д. 9, 206689",2164,Onlangs
5078767631498,Stephenson Group,"д. Щелково, пер. Торговый, д. 794, 292547",2423,
1024178489334,Rodriguez Group,"с. Гаврилов-Ям, пер. Коммуны, д. 76 к. 942, 507404",2463,
5223835313500,"Franklin, Sanders and Davis","п. Тавда, алл. Сосновая, д. 25 стр. 632, 558000",2028,Bevriend
1208982936975,Jensen-Martinez,"с. Новомичуринск, наб. Белорусская, д. 7/4 к. 6, 883457",481,Deken
5169174020219,Phillips and Sons,"ст. Тольятти, бул. Выгонный, д. 9/7, 120294",814,Taal
1120544549047,"Barr, Davis and Lawson","к. Кострома, пр. Микрорайон, д. 279 стр. 997, 874404",2981,Heen
1173815207169,Walker-Martinez,"д. Чебоксары, пер. Куйбышева, д. 123 к. 2/1, 931677",2889,Kreeg
1211565037386,Patton-Scott,"с. Кирово-Чепецк, пер. Чехова, д. 481 стр. 4, 000416",2340,Tegenhouden
5156929298510,Soto LLC,"к. Галич, ш. Советской Армии, д. 4, 857560",1922,Jess
1015902353081,"Pace, Arias and Mcdowell","ст. Тында, пер. Зеленый, д. 9/5, 091740",2924,
1024401322824,"Brown, Rodriguez and Fisher","клх Самара, бул. Водопроводный, д. 54, 059957",2235,Vloek
5152104129535,Dennis-Robinson,"с. Томск, наб. Союзная, д. 3 к. 5, 113964",1228,Stijl
5055852653467,"Weaver, Booker and Morrison","г. Дзержинск, алл. Павлова, д. 4/3 стр. 358, 206626",868,Geely
1126980092799,"Patrick, Carter and Fisher","к. Соликамск, наб. Баумана, д. 3, 272615",1888,
5049057849242,Williams-Mclaughlin,"клх Надым, пр. З.Космодемьянской, д. 25 стр. 62, 751058",903,
1186251470591,Schroeder PLC,"ст. Троицк (Моск.), ул. Крылова, д. 206 к. 75, 888139",2531,Nicky
1017173232361,Mahoney-Ferrell,"с. Светлогорск (Калин.), пр. Сурикова, д. 722 к. 9/9, 452273",21,Genoeg
5151252725531,Wolf Ltd,"д. Билибино, наб. Вокзальная, д. 5 стр. 7, 035690",1860,
1087596319447,Patterson-Graves,"к. Челябинск, бул. Городской, д. 48 стр. 588, 638526",1687,Leugen
1220811431235,Yoder-Benitez,"к. Можайск, ул. Шаумяна, д. 45 стр. 2, 534240",2090,
5031502442131,"Craig, Carr and Baker","д. Эльтон, пер. Владимирский, д. 5 к. 3/2, 622126",2002,
5191308191993,Brooks-Bates,"к. Хоста, ул. Тихая, д. 963 стр. 567, 829385",2497,Nissan
5137354118501,"Hall, Black and Farmer","г. Мокшан, ул. Овражная, д. 702 стр. 4/7, 063895",2143,
1224953591873,Moore-Henry,"п. Лабытнанги, ш. Розы Люксембург, д. 797 стр. 5, 262006",171,
1080275738091,"Moore, Richardson and Barry","к. Холмогоры, ул. Ульяновская, д. 30 стр. 8/2, 423163",992,Wanhopig
5196790335650,Macias LLC,"с. Мокшан, наб. Камская, д. 8/7 стр. 3, 676648",2825,Weggegaan
5174987288560,Campbell Inc,"с. Малая Вишера, пр. Степной, д. 47 к. 2, 623003",2911,Opeten
5061270109533,Brennan-Mclean,"д. Красноселькуп, алл. Ясная, д. 3/1 к. 177, 026523",2982,Generaal
5131415877687,"Leon, Mclaughlin and Cross","к. Канск, алл. Малиновая, д. 6 к. 84, 710806",2301,
5102009970849,"Hall, Coleman and Dickerson","к. Вологда, пер. Дальневосточный, д. 858 стр. 931, 855562",2644,Bravo
5094387639913,"Lawrence, Reyes and Mills","д. Кяхта, бул. Кочубея, д. 3 стр. 21, 104009",2712,
5026820522713,"Cherry, Patterson and Sullivan","п. Пышма, наб. Литейная, д. 470, 074631",1697,Gaven
5027711736740,Hampton Group,"к. Южно-Сахалинск, ш. Нижнее, д. 623 стр. 60, 700013",1016,Land Rover
1157988161682,Carter Group,"клх Белоярский, ш. Малое, д. 8/6 к. 2, 813163",1981,Vanzelf
1171191491712,"Brown, Walters and Brown","д. Мурманск, пр. Кедровый, д. 1 к. 42, 938903",1406,
1063358343872,"Johnson, Curtis and Holden","д. Яшкуль, наб. М.Горького, д. 7/2 стр. 5, 571174",1268,
1014918562328,Roberts-Salazar,"клх Ноябрьск, ул. Одесская, д. 1, 047134",2457,Temperatuur
1133094078149,Garcia-Vargas,"клх Серафимович, пер. Морской, д. 4/4 стр. 5/5, 455065",1142,
1076492353728,Gill-Price,"с. Уварово, бул. Заозерный, д. 1 к. 847, 699229",2130,
5147121324356,Rowe Ltd,"к. Терней, ш. Запорожское, д. 31 стр. 9/6, 802198",1382,Uitstekend
5058800934583,"James, Chandler and Barker","г. Тосно, наб. Кавказская, д. 452, 855733",2177,
1092717376180,Valenzuela Inc,"г. Моршанск, пер. Некрасова, д. 264, 016373",2514,
5114388250675,"Zimmerman, Moore and Walters","к. Дербент, ш. Льва Толстого, д. 6/7, 937550",2299,Wou
5212595866907,Porter-Summers,"к. Подольск, пер. Безымянный, д. 811 к. 279, 309419",2502,Bomen
5152040152556,"Campbell, Phillips and Adams","с. Урюпинск, наб. Просторная, д. 4/3 стр. 50, 449324",1311,Gebracht
5093097188465,Hess Group,"г. Прохладный, пр. Дружба, д. 7/9 стр. 2, 316851",1843,Jullie
5095912398027,Gonzales-Roberts,"ст. Омск, алл. Зои Космодемьянской, д. 302 стр. 5, 358105",2269,
1030793135757,Warner-Prince,"с. Кабанск, бул. Красноармейский, д. 19 к. 50, 599622",1031,Dacht
1121421264250,Sandoval PLC,"ст. Калевала, бул. Тихий, д. 32, 148177",848,
1172140162446,Conley and Sons,"п. Усть-Джегута, пр. Ватутина, д. 7/1 к. 62, 577318",2133,
5024924731123,Bentley-Jones,"д. Абакан, пр. Кавказский, д. 6/1 к. 9, 648379",2277,Meestal
5083443686354,"Johnson, Bradley and Jackson","ст. Камень-на-Оби, пер. Морозова, д. 900, 725969",2496,Leugen
1133106272750,Hubbard PLC,"с. Ярославль, ш. Заречное, д. 1, 380612",1997,
1227717103294,"Allen, Schneider and Higgins","д. Луховицы, алл. Тупиковая, д. 645 стр. 80, 328528",2524,Ene
1212753997235,"Lopez, Tran and Lucas","ст. Кущевская, пр. Дарвина, д. 5/6 стр. 874, 975597",2765,
1051249589346,Poole-Lee,"ст. Обнинск, пер. Советский, д. 1, 754469",1187,West
1060991000608,Spears-Dunlap,"с. Тотьма, пер. Дорожников, д. 89 стр. 4, 018547",1317,Menigte
1185932521147,Landry-Watson,"с. Дудинка, пер. Новосельский, д. 3/2, 822956",1965,
5050149476185,Vazquez-Gentry,"с. Воткинск, пер. Краснофлотский, д. 716 к. 75, 741517",1487,
5010369538658,"Oliver, Murphy and Gates","с. Голицыно, ш. Рязанское, д. 88, 276405",447,
1129283602931,Walker-Roberts,"д. Данков, ш. Дорожников, д. 993 стр. 5/3, 736284",392,Alvast
5166762145270,Koch-Mitchell,"с. Владикавказ, наб. Придорожная, д. 84 к. 720, 167002",2880,Held
1162097414907,Knight-Jones,"клх Черемхово, бул. Микрорайон, д. 3/4 к. 4, 297433",2013,Wandelen
1161975293370,Andrews-Blackburn,"ст. Шамары, наб. Песочная, д. 4, 905877",1983,St
1171089958710,Sullivan-Munoz,"п. Шумиха, ш. Российское, д. 77 к. 9/2, 224680",1327,
5160949517900,Brown-Maddox,"с. Крымск, ш. Снежное, д. 3/4 к. 8/3, 149947",2070,Gewone
5170562640573,Good-Kidd,"клх Уфа, ш. Челюскинцев, д. 8/6, 073560",1409,Pijn
1060419950348,Lozano-Brown,"к. Губаха, наб. Буденного, д. 66 стр. 99, 765184",528,Honden
1177199509530,"Lee, Anderson and Anderson","ст. Нижний Новгород, наб. Грибоедова, д. 2, 412552",2832,
1162408717107,Mitchell-Long,"к. Ухта, наб. Невского, д. 6, 185309",2621,
1173988383381,Foster-Bell,"клх Касимов, наб. Енисейская, д. 47 стр. 3, 498025",1435,
5150280015089,Humphrey-Wilson,"д. Воронеж, алл. Лазо, д. 77 стр. 7, 305721",493,
5110447462065,Beasley-Hughes,"д. Ямбург, пр. Майский, д. 8 к. 5, 243691",2787,
1027144170129,Johnson and Sons,"ст. Беломорск, пер. Октября, д. 892 стр. 1/5, 731495",1934,
1013360461267,"Wheeler, Brown and Ross","д. Тавда, пер. Тельмана, д. 2/7 к. 864, 209327",678,
5112834765050,"Mckinney, Clark and Glass","ст. Кырен, пр. Алтайский, д. 416, 946864",2758,Taal
5117213231890,Harris and Sons,"ст. Богучар, ул. Гайдара, д. 83, 856385",1731,Vraagt
1213103892143,Barton and Sons,"ст. Балтийск, бул. Энгельса, д. 7/9 стр. 6/3, 450751",38,Mitsubishi
1177512273080,"Thornton, Phillips and Davis","д. Москва, МГУ, алл. Подстанция, д. 1, 221379",1982,
5134433485324,"Wilson, Hernandez and Cruz","с. Тында, пер. Мостовой, д. 2/9, 296189",1776,
5025391881576,Daniels Ltd,"ст. Усть-Баргузин, пер. Путевой, д. 5 к. 66, 112898",575,Ellen
1195352396029,"Coleman, Medina and Boyd","г. Курганинск, наб. Новосельская, д. 27 стр. 89, 525411",1343,
1025720128950,"Marquez, Gonzalez and Hernandez","с. Беслан, ул. Ореховая, д. 8 стр. 30, 946557",1993,Dieren
5040642305809,"Miller, Brown and Guzman","г. Ачинск, алл. Репина, д. 97 стр. 6, 455752",1668,
5118312668568,Cooper Inc,"п. Касимов, ш. Ростовское, д. 8/4 к. 55, 572056",2503,Legt
5048785187061,"Gardner, Martinez and Frederick","ст. Кемерово, пр. Комсомольский, д. 8/2 к. 982, 746982",1213,Ergens
5073624671049,Gomez-Barajas,"к. Волоколамск, бул. Производственный, д. 6 к. 450, 689992",180,Kilometer
5213425900265,"Schroeder, Mcdaniel and Russell","д. Черский, наб. Прудная, д. 672 стр. 1/8, 506702",2629,Graden
5225991115686,Ballard-Fuller,"клх Вологда, наб. Матросова, д. 6 к. 73, 240773",1677,
5157523243378,Richardson-Miller,"г. Усть-Кут, пр. Высокий, д. 96 стр. 84, 969740",1120,Promotie
1122450577589,Hinton Group,"к. Южно-Сахалинск, пр. Ставропольский, д. 67 стр. 1/3, 810017",1567,Samantha
1075326383857,Taylor LLC,"г. Воронеж, наб. Ключевая, д. 47 стр. 8/5, 217494",427,
1143035769425,Bryant-Bullock,"с. Елатьма, алл. Городская, д. 638 к. 531, 216086",964,Opzet
5142919628220,"Houston, Dixon and Young","с. Яхрома, пер. Огородный, д. 82 стр. 2, 085599",100,
5094067053262,Contreras and Sons,"с. Мирный, наб. Славянская, д. 4/6 к. 5/1, 770225",1316,Leest
5205143566975,Spencer Ltd,"к. Стрежевой, бул. Отрадный, д. 19 стр. 2/3, 809407",262,Vrolijk
1122722993854,Allen-Fisher,"г. Голицыно, наб. Шишкина, д. 6 стр. 1, 607501",2157,He
1207820948609,"King, Martinez and Brown","клх Пинега, пер. Прохладный, д. 3/8, 538883",1810,
5047188591863,"Jones, Ross and Sims","д. Ставрополь, пр. Иркутский, д. 2 стр. 188, 839017",1840,Beroemd
5175323167840,Powell-Green,"с. Баксан, ш. Алтайское, д. 7/8 стр. 21, 619320",2049,
5165381030623,Thompson-Mcclure,"к. Абакан, ул. Путевая, д. 5 к. 132, 153538",2041,
5205319740060,"Stewart, Jensen and Kennedy","д. Верхнее Пенжино, наб. Макаренко, д. 2/3 стр. 572, 159955",178,Stan
1215110460289,Everett-Banks,"г. Кашхатау, пр. Тимирязева, д. 3, 516960",2455,
5051285050405,Gray-Ortiz,"п. Ноглики, пер. Заводской, д. 35 к. 8, 048804",2539,Www
5076342483366,Ramirez Ltd,"с. Снежинск, алл. Розы Люксембург, д. 1, 053195",652,Flinke
1014996360312,"Tyler, Doyle and Powers","к. Миасс, бул. Медицинский, д. 71, 531330",1963,
5192343641310,Dyer-Gomez,"клх Ряжск, алл. Заовражная, д. 947 к. 677, 981951",2505,
1197376415510,Benson Inc,"д. Моздок, ш. Некрасова, д. 9, 014779",79,
5132068048789,Phillips-Cross,"д. Октябрьский (Башк.), пр. Машиностроителей, д. 8/2 к. 2, 035158",1648,Waarheid
5036447146500,"Romero, Johnson and Howell","г. Нягань, алл. Толстого, д. 949, 238903",695,
5038291284532,"Kim, Harris and Jenkins","к. Вытегра, бул. 50 лет Октября, д. 713 стр. 5, 064473",2761,
1220611861370,Snyder PLC,"клх Благовещенск (Амур.), пер. Гайдара, д. 944 к. 97, 890344",2034,
5157172602439,Bridges-Parks,"п. Усолье Сибирское, бул. Овражный, д. 56 стр. 4/9, 975901",733,Sectie
5211649664727,Carrillo Inc,"клх Кыштым, пер. Алтайский, д. 47 к. 5/9, 338803",1472,
5092459069445,"Davis, Swanson and Walton","д. Солнечногорск, ш. Ягодное, д. 440 стр. 811, 806862",1339,
5223766147952,Crawford-Nelson,"г. Кировск (Ленин.), наб. Луначарского, д. 494, 395675",1538,
5011077045227,"Leonard, Brown and Dyer","с. Ведено, наб. Омская, д. 7/2 к. 9, 870565",2016,
1036748518730,"Carpenter, Wilson and Crawford","с. Калач-на-Дону, бул. Попова, д. 28 к. 486, 519913",1833,
5081023858273,"Sweeney, King and Garcia","д. Ульяновск, бул. Ватутина, д. 7/8 к. 8, 280280",290,Burgemeester
1212424929970,Gonzalez-Williams,"д. Малая Вишера, пер. Мая 1, д. 8/9, 765081",2324,Duitsland
5127728407417,Wyatt PLC,"п. Тутончаны, наб. Подстанция, д. 36 к. 24, 842199",2900,
5082990936012,Roberts Group,"ст. Мирный, ул. Буденного, д. 169 к. 1, 775211",230,
5071083660456,Rowe-Galvan,"к. Котлас, алл. Менделеева, д. 740 стр. 3/3, 382221",492,
5094462350494,Newman-Phillips,"с. Амдерма, бул. Заречный, д. 3, 925182",2988,
1058282859821,"Coleman, Bates and Hanson","г. Киров (Вятка), наб. Ангарская, д. 7/3 стр. 3, 702876",1828,Terugkeren
5180502232312,Castillo-Byrd,"клх Сургут (Хант.), алл. Энергетическая, д. 3/8 к. 218, 978566",1433,
5083867151154,"Garcia, Wilson and Martinez","г. Черусти, пер. Инженерный, д. 668, 681584",953,Zender
5162512942730,"Hill, Harris and Martinez","д. Яшкуль, пер. Деповский, д. 43, 163396",736,
5028401561117,Marquez-Olson,"к. Горячий Ключ, алл. Дружбы, д. 166 к. 7/8, 460526",1146,
1024860117402,"Perez, Rodriguez and Sanchez","г. Буйнакск, наб. Алтайская, д. 72, 936484",2883,Gemakkelijk
1136561774360,Miller-Graves,"д. Верхоянск, ул. К.Маркса, д. 9, 509593",876,Sleutel
1210799164311,"Floyd, Welch and Wilson","г. Пушкин, наб. Пархоменко, д. 9 к. 26, 682501",610,Verdwenen
5041070534918,Smith Group,"клх Бомнак, ул. Пушкина, д. 334, 275338",2563,Gemakkelijk
1197932743216,Robinson Ltd,"д. Катайск, бул. Вокзальный, д. 7/6, 357437",2947,Zonden
5078772382904,Leonard-Henderson,"г. Ведено, ул. Путевая, д. 2 к. 2/6, 266510",2509,
1041807430664,Howard-Garcia,"п. Каменск-Уральский, ш. Шахтерское, д. 6 стр. 70, 378872",249,
1073370325698,"Scott, Carr and Jones","ст. Сусуман, алл. Прудовая, д. 4 к. 96, 342534",121,
1067939031786,Martinez-Davis,"д. Билибино, пер. Мелиоративный, д. 32, 427856",1214,Zussen
1155780021913,Ray-Guerrero,"ст. Батайск, алл. Раздольная, д. 4/5 стр. 31, 170388",2807,
5200656434545,"Welch, Ramos and Johnson","клх Хасан, пер. Пригородный, д. 2 к. 459, 395217",1418,
5206703842131,"Nash, Martinez and Parker","д. Крымск, ул. Смоленская, д. 3, 348661",1961,
1206118118524,"Sanchez, Newman and Gray","п. Кетченеры, алл. Курчатова, д. 8/1 стр. 6, 791760",1761,
5193507846880,Villa-Miller,"г. Тотьма, алл. Интернациональная, д. 95 к. 781, 621518",2771,Ontkennen
1121680664489,Young-Edwards,"д. Югорск, ул. Гастелло, д. 156 стр. 14, 791012",958,
1145455737624,Wilson-Mcdonald,"д. Канск, бул. Ватутина, д. 63 к. 94, 091652",2591,Illegale
5188601692285,Keith-Garcia,"к. Забайкальск, наб. Больничная, д. 9/3 стр. 27, 766287",1870,
5191863332810,Jones Ltd,"г. Ишим, алл. Прудовая, д. 62, 163744",2175,Idee
1024264057290,Sanders-Solis,"к. Оймякон, алл. Урицкого, д. 62 стр. 3/4, 788953",1276,Geslagen
1088253521201,"Clark, Jimenez and Anderson","клх Южно-Курильск, наб. Совхозная, д. 941 стр. 999, 258025",396,Ziet
5187159898569,Larsen-Lynch,"к. Шатки, пер. Пионерский, д. 95 к. 94, 995053",2438,Veroorloven
5218862098208,"Rodriguez, Mejia and Copeland","клх Саратов, наб. Калужская, д. 639 стр. 8/8, 402762",587,
1168763848340,Short-Harris,"ст. Плесецк, алл. Водников, д. 4/2, 369243",669,Meest
1078517944812,Luna-Lopez,"клх Яхрома, ш. Максима Горького, д. 607 стр. 1/2, 422415",1207,Biedt
5168526177364,"Wilcox, Hendrix and Watson","д. Катайск, ш. Космодемьянской, д. 5, 394462",1058,BMW
5219085606658,Mccarthy-Michael,"ст. Тула, пер. Сурикова, д. 9/4, 562432",2551,
5153440294321,Brown-Hoffman,"ст. Верхоянск, бул. Красноармейский, д. 286 к. 71, 546133",1385,Asjeblieft
1084794475292,Lyons-Morris,"п. Куртамыш, наб. Зеленая, д. 6 к. 3, 020621",762,
5175321465897,Sanchez Group,"п. Якша, пр. Сиреневый, д. 544 к. 164, 605843",1452,
5162883302874,Hall-Dennis,"ст. Юрюзань, ул. Осенняя, д. 2/9 стр. 8, 825593",694,
5130458245506,"Cooper, Douglas and Smith","г. Печора, алл. 50 лет Октября, д. 227 к. 9, 351298",2908,
1031425836144,Peterson and Sons,"к. Каргасок, алл. Спортивная, д. 8 к. 573, 567664",2079,Vrouwelijke
5204602264158,Mendoza-Riggs,"п. Рыбинск, алл. Гончарова, д. 7/3, 832424",1092,
5142983702330,Mitchell-Valenzuela,"г. Королев, алл. Нахимова, д. 6, 552257",1883,
1050586027997,"Wang, Harrington and Brooks","д. Ачхой Мартан, ш. Индустриальное, д. 43 к. 99, 200301",1359,Hij
1075331984782,"Sandoval, Gregory and Martinez","ст. Рославль, алл. Просвещения, д. 401 стр. 3, 554366",407,Oefening
5018704068015,Rowe-Johnson,"г. Славгород, пер. Прохладный, д. 736 к. 87, 251042",2228,
1084234807293,Nelson-Johnson,"с. Тарко-Сале, бул. 70 лет Октября, д. 541 к. 134, 418852",2843,
5158345564053,Baker PLC,"ст. Хатанга, наб. Маркса, д. 2/9 стр. 4/8, 948984",1419,Ceremonie
5143199971800,Lester LLC,"д. Саратов, алл. Высоцкого, д. 2 к. 6/1, 090074",990,
5021157647143,Solis-Reid,"ст. Славянск-на-Кубани, алл. Пригородная, д. 800 к. 4, 996983",2893,
5134281185253,Peters-Anderson,"клх Тихорецк, пер. Республиканский, д. 87, 673155",2191,Spider
5143622250250,Davis PLC,"к. Холмогоры, наб. Стадионная, д. 9 к. 5, 407063",578,Verknald
5201941449485,"Harrell, Robinson and Gomez","клх Урай, алл. Медицинская, д. 148, 084252",1193,Nissan
5101966733534,Castro LLC,"с. Выборг, бул. Пушкина, д. 40 стр. 4, 733986",1609,Aanslag
1014916435335,Rivera-Henson,"с. Новомосковск, ул. Ульянова, д. 61 к. 23, 016911",2544,House
1145108022553,"Thomas, Gill and Miller","к. Губкин, бул. Леваневского, д. 9 стр. 236, 216958",2609,
5054041696946,"Rivera, Wilkinson and Mitchell","г. Онега, ул. Короткая, д. 13, 189895",2216,Menigte
5153330418291,Tran-Marquez,"г. Хабаровск, наб. Одесская, д. 9/6 к. 6/1, 269852",2682,
5150842509648,Shaffer LLC,"д. Надым, ш. 9 Января, д. 52 стр. 4/2, 124217",1405,Nieuwe
1213758239870,"Shea, Logan and Martin","с. Ульяновск, наб. Макарова, д. 225, 374462",1042,Japanse
1070934570761,Manning and Sons,"п. Костомукша, алл. Бажова, д. 732 к. 7/4, 991995",276,
5042072619090,French-Baker,"ст. Октябрьское (Хант.), пер. Шевченко, д. 12 стр. 64, 502358",1513,Uitzoeken
5086436949990,Heath-Palmer,"ст. Североморск, наб. Дзержинского, д. 56 к. 7/1, 002603",2778,
5106933913532,Chavez PLC,"д. Коломна, наб. Сахалинская, д. 37 стр. 61, 872099",320,
1184446830633,"Sanchez, Hansen and Smith","клх Бирск, бул. Папанина, д. 158, 388225",2959,Noodzakelijk
1025776227344,"Hall, Cooper and Garcia","п. Быково (метеост.), ул. Светлая, д. 36 стр. 3/1, 461565",2128,
5123439860737,"Ritter, Lane and Hernandez","клх Кашира, алл. Водопроводная, д. 52 стр. 15, 956342",889,
1152436039447,"Johnston, Wallace and Thompson","д. Нерчинск, наб. Новосельская, д. 316 к. 774, 801370",1464,
1190243330078,Jackson-Lambert,"клх Яшкуль, ш. Красноармейское, д. 6/1 стр. 327, 665037",1036,Leren
1160710108448,Scott LLC,"п. Бийск, пер. Петровский, д. 45, 793868",2339,Trainen
1026348818341,Brown-Le,"клх Северодвинск, пер. Детский, д. 9/5 к. 2, 140033",2534,
1103743324080,"Smith, Guerra and Aguirre","клх Андреаполь, алл. Просторная, д. 8, 338235",855,
1095359711237,Joseph-Gonzalez,"г. Сунтар, алл. Угловая, д. 12 к. 6, 716064",1619,Tanden
1213487963700,Phillips Ltd,"д. Мураши, наб. Приозерная, д. 543, 447688",1486,Doug
1068283903962,Smith-Wilson,"к. Черкесск, ш. Волжское, д. 15, 948145",1013,
5106408876404,Murphy-Taylor,"г. Палана, алл. Глинки, д. 8/2, 426564",581,Plan
1041131358619,Kennedy-Taylor,"с. Партизанск, пр. Металлистов, д. 824 к. 5/5, 573534",974,House
1158154941614,"Shelton, Landry and Walker","к. Набережные Челны, бул. Кочубея, д. 8, 820890",1562,
1028784007471,Abbott-Castillo,"клх Белореченск, наб. Школьная, д. 69 к. 1/7, 460535",2184,Bied
1041117371448,Lucas Group,"клх Всеволожск, алл. Белорусская, д. 479 стр. 55, 483582",1170,Chery
1078502329234,"Miller, Moreno and Lynch","г. Адыгейск, наб. Крайняя, д. 3/1 к. 4, 299789",1694,Datsun
5110523786060,Graham-Greene,"д. Старый Оскол, наб. Восьмого Марта, д. 3/7 стр. 427, 106577",2530,
5174766752298,Holden Inc,"ст. Ульяновск, пр. Дальний, д. 5/5 стр. 537, 789777",1542,
1187765193945,Harris-Terry,"к. Череповец, ш. Шаумяна, д. 1/1 к. 26, 776179",23,
1147882870101,Rojas-Nguyen,"п. Ялуторовск, наб. Привольная, д. 4 к. 82, 515349",947,Dronken
5172093542693,Jones-Brock,"к. Тура, бул. К.Маркса, д. 283 стр. 2/7, 732185",624,Halve
5125058204684,Barrett LLC,"с. Южно-Сахалинск, алл. Шахтерская, д. 90 к. 674, 902658",1820,Gemene
5083986720780,Lopez and Sons,"к. Апатиты, ш. Березовое, д. 9/7 стр. 451, 349418",1279,Gat
1213221408564,"Chambers, Williams and Atkins","д. Томск, ш. Космонавтов, д. 5 к. 44, 832221",58,
1163975642170,Allison Inc,"с. Рыльск, пр. Ватутина, д. 48, 857539",1128,Kenden
5185269112001,Pratt LLC,"к. Луга, алл. Жукова, д. 779, 775939",267,
1130186927287,Baker-Cardenas,"с. Анадырь, алл. Портовая, д. 6/2 стр. 4, 043814",2700,
5025485125100,Frye-Ramos,"д. Москва, алл. Раздольная, д. 8/2 к. 3, 517482",1412,
5181812661410,"Berg, Terrell and Bennett","клх Пермь, бул. Геологический, д. 3, 469993",2725,
