5177444807623,Santana Group,"с. Крымск, пр. Краснопартизанский, д. 374 к. 1/3, 730170",2364,Staren
5076122159350,Allen Inc,"д. Макушино, бул. Пушкинский, д. 9 стр. 4, 796319",792,
1098596972231,Brennan-Bennett,"к. Оренбург, алл. Саратовская, д. 491 стр. 952, 513158",32,Zagen
1021125178645,"Mcbride, Massey and Cook","с. Макаров, алл. Карла Либкнехта, д. 2 к. 204, 028414",1884,Dat
5186809446478,Hanson and Sons,"п. Ачхой Мартан, наб. Крестьянская, д. 45, 347326",691,
5133671070176,"Long, Wallace and Maddox","к. Миллерово, бул. Малиновый, д. 11, 887670",1637,Muis
1058991392294,Jones PLC,"клх Адлер, алл. Горького, д. 91, 655443",946,
1031419859448,Jacobson-Steele,"с. Видное, алл. Харьковская, д. 5 стр. 85, 043761",646,Moeilijke
5125124634278,Lucero-Franco,"клх Ямбург, бул. Заовражный, д. 99 стр. 7, 991012",566,
1150100315793,Johnson LLC,"к. Боровск, наб. Локомотивная, д. 490 к. 7, 959683",1841,
1136097056831,Wright-Morton,"к. Киров (Вятка), ш. Черемуховое, д. 554 к. 841, 790682",501,Dronken
1180160080550,"Martin, Hill and Cole","д. Амдерма, ш. Водников, д. 4/8, 046820",1388,
5156265961297,Harris LLC,"п. Краснотурьинск, бул. Суворова, д. 760 стр. 7/8, 060111",2733,Oosten
5105389451943,Fowler LLC,"к. Пермь, пер. Станционный, д. 5/2 к. 474, 300780",2337,
1061821222429,Rodriguez Ltd,"клх Новомосковск, ул. Строительная, д. 83, 090734",49,
1148608725187,Norman-Farmer,"д. Неплюевка, пер. Вокзальный, д. 6, 829689",1451,Steken
5104203782051,Skinner Inc,"г. Балашов, наб. Новостройка, д. 42, 424615",69,Telefoon
1199018381858,"White, Chen and Taylor","к. Тверь, наб. Пушкинская, д. 240 стр. 9, 423526",1147,Ongetwijfeld
5115897201525,"Byrd, Davis and Fuller","п. Баксан, пр. Запрудный, д. 9 стр. 48, 384170",444,West
5222072397421,Bennett Ltd,"к. Томпа, ш. Гражданское, д. 2/9, 675691",1659,
5084732039882,"Fox, Murphy and Shaw","г. Чайковский, наб. Ульянова, д. 297 стр. 751, 358900",1525,
5103628884365,Smith-Bell,"п. Каменск-Уральский, ул. Высокая, д. 75 стр. 6, 729796",846,Ook
1164426244135,Lewis-Richardson,"г. Мураши, алл. Флотская, д. 9, 519343",2662,Opa
1217029265331,Harris-Burgess,"г. Чебаркуль, пр. Авиационный, д. 9/7, 308263",654,Praat
1065034764915,"Mccall, Hutchinson and Bowen","клх Неплюевка, алл. Коммунаров, д. 5, 839937",2440,
5145323915138,"Cabrera, Burke and Walker","ст. Курумкан, ул. Маркса Карла, д. 2/6, 979712",1469,Gerucht
5048579667659,"Fox, Randall and Smith","п. Приморско-Ахтарск, ул. Октября, д. 84, 261764",854,Walt
1104473974780,Moore-Ramirez,"клх Апатиты, наб. Тамбовская, д. 184, 201030",2099,
5155399798021,"Hobbs, Wu and Morales","клх Поронайск, алл. Калужская, д. 670, 558123",2938,
1213027006455,Carter and Sons,"к. Карталы, пер. Лазурный, д. 2/3, 559297",2058,
1166973474304,Johnson LLC,"к. Нягань, пер. Сплавный, д. 289, 070836",2619,
1132259322315,Haas Inc,"ст. Ельня, пр. Братский, д. 5 к. 2/3, 848423",2581,
5197839021760,Shelton LLC,"к. Видное, пер. Астраханский, д. 599, 120041",2953,Voorkant
5202025782020,Adkins and Sons,"ст. Невьянск, пр. Ватутина, д. 55 стр. 2/9, 877235",2691,Leugens
5222275673329,"Miller, Owens and Coleman","д. Сосновый Бор, ш. Шахтерское, д. 576 стр. 562, 878406",753,
1121511119652,Clayton-Duncan,"г. Архыз, бул. Студенческий, д. 9/2 стр. 5/8, 111139",2448,Bouwen
1127571074003,Lopez PLC,"с. Тихорецк, бул. Орловский, д. 86 стр. 258, 642395",1999,Verdwijnt
5173147661638,"Roth, Hayes and Mcdonald","г. Объячево, пр. Смоленский, д. 9, 648373",2666,
1163936157032,Montgomery PLC,"п. Арсеньев, наб. Кольцова, д. 7/8 к. 695, 286455",651,
5071123691690,Mccarty-Reese,"ст. Подольск, ул. Мельничная, д. 36, 955438",412,
1223607658064,"Flores, Webb and Taylor","клх Омск, ул. Прибрежная, д. 6/9 к. 798, 586395",2400,
5120191603110,"Lewis, Taylor and Cummings","к. Торжок, ш. Малое, д. 70 стр. 1/8, 365359",2282,
5194152337132,Moore LLC,"д. Магнитогорск, ул. Совхозная, д. 5, 755521",2855,
1083316700477,"Sims, Gibson and Cooper","г. Томпа, пер. Тюленина, д. 987, 876940",956,Kalmeer
1148922132787,Melendez and Sons,"п. Красноуральск, бул. Челюскинцев, д. 813 стр. 8, 802912",416,
1166992776136,Maddox and Sons,"д. Кимры, бул. Клары Цеткин, д. 8 к. 56, 398684",693,Troy
5102449509124,"Hall, Griffith and Bright","п. Россошь, пер. Краснопартизанский, д. 28 стр. 9/4, 401107",2446,
1185021184633,"Franklin, Murphy and Robinson","клх Александров Гай, алл. Водопроводная, д. 796, 123602",1506,Restaurant
1146651575311,Wilson PLC,"г. Тура, ул. Запрудная, д. 3/5 к. 392, 211234",254,
1042623105282,Nash Inc,"п. Тулпан, алл. Коммуны, д. 70 к. 8/7, 035632",1770,
5212607286800,Fox-Brady,"г. Серафимович, пр. Советский, д. 655, 027342",2680,Zeuren
1160674944638,"Johnson, Howell and Villanueva","клх Раменское, наб. Свердлова, д. 40 стр. 4, 570467",1797,
1128668516954,"Johnson, Smith and Wyatt","г. Яшалта, ш. Иркутское, д. 747, 291062",2529,
1121302793864,Washington-Bailey,"с. Устюжна, бул. Речной, д. 201 стр. 426, 520152",2774,Winkelcentrum
5187751275113,Baker PLC,"ст. Белогорск (Амур.), ул. Московская, д. 1 стр. 3/9, 149898",994,
5106123544368,Thompson-Russell,"к. Кандалакша, пер. Краснопартизанский, д. 1/5 стр. 4, 180511",2125,
5152854008951,"Rose, Olsen and Garcia","г. Октябрьский (Башк.), пер. Хвойный, д. 973 к. 393, 014394",2522,
5228083378750,Smith Group,"п. Курильск, пр. Высокий, д. 224 к. 494, 873487",2296,Afscheid
1204488272493,Goodman-Bauer,"с. Воронеж, ш. Серафимовича, д. 562, 371262",997,
5134391092260,"Morales, Richards and Hill","ст. Северо-Курильск, ш. 1 Мая, д. 591, 292246",1705,Land Rover
5165859048339,Wilson-White,"г. Минусинск, пер. Школьный, д. 75 к. 9, 418769",2528,Goedemorgen
5148884511606,"Cooper, Kaiser and Hampton","с. Малая Вишера, алл. Космодемьянской, д. 5 стр. 915, 963523",2661,
5194289921513,"Grant, Nguyen and Ramirez","к. Темрюк, ш. 50 лет ВЛКСМ, д. 1/4 стр. 889, 522491",2547,Mitsubishi
5085265563026,Perez Group,"п. Чермоз, пр. Городской, д. 6/5 к. 8/8, 331479",2541,
5082577821410,Nash Ltd,"г. Черусти, ш. 60 лет Октября, д. 4 стр. 226, 979488",642,Jacob
1143604300586,Logan-Mills,"клх Минусинск, ул. Менделеева, д. 5 к. 8/8, 116449",2990,Amerikaanse
1110773664143,Rios-Frye,"к. Аргаяш, наб. Луначарского, д. 4/4 к. 60, 144692",1889,
1185385517536,Moss and Sons,"с. Южноуральск, ул. Льва Толстого, д. 7/9 стр. 6, 976166",1079,Onlangs
5024875548440,Henry Inc,"клх Карталы, ш. Гончарова, д. 4/1 к. 445, 667308",2543,
5185067609854,Curtis and Sons,"клх Лесной (Сверд.), бул. Полевой, д. 675 стр. 87, 846392",2365,
5168932696730,Riley Ltd,"клх Макаров, пр. Братский, д. 12 к. 5, 791406",1387,Alarm
5142040862937,"Davis, Moreno and Harris","п. Ханты-Мансийск, ул. Зои Космодемьянской, д. 9/3 стр. 94, 365446",2056,
1106001803874,Brewer-Hill,"д. Владивосток, ш. Гражданское, д. 640, 904794",430,
1059118683216,Perry Ltd,"ст. Минеральные Воды, ул. Водопроводная, д. 734 к. 78, 157569",2326,
1057618573396,Riley Group,"д. Ачхой Мартан, пер. Слободской, д. 5, 757907",2676,
5200431320876,Lee PLC,"д. Жигулевск, ш. Высокое, д. 439 к. 502, 815786",2873,And
5044140981605,Wright-Gonzalez,"с. Усть-Камчатск, алл. Карла Маркса, д. 470, 231905",2176,
1207782050145,Riley-Bennett,"с. Таштагол, пер. Геологический, д. 98 стр. 3, 355515",1569,
1121178759371,Grant LLC,"к. Саров (Морд.), ул. Стахановская, д. 5 стр. 9/1, 564945",962,
5065856392311,Gordon and Sons,"к. Ханты-Мансийск, ул. Металлургов, д. 79, 512879",1103,
1194036469263,Davis Ltd,"ст. Билибино, ш. Некрасова, д. 3, 067889",2857,Verwijderen
1035500104155,Ryan-Washington,"д. Учалы, пер. Тюленина, д. 54 стр. 4/3, 609566",1627,Veroorzaakt
5091788456777,"English, Turner and Hill","с. Малоярославец, пер. Семашко, д. 6/4 стр. 2, 818039",960,Winter
5024596223779,Escobar-Willis,"п. Солнечногорск, наб. Ермака, д. 898 к. 7, 290890",1534,
1084631631633,Cisneros-Avery,"п. Брянск, ш. Черемуховое, д. 7 к. 23, 854294",333,
5083346560457,"Donovan, Rivera and Malone","к. Сосновый Бор, наб. Победы, д. 21 стр. 41, 095084",1227,
5038260714839,Robertson and Sons,"п. Ершов, бул. Ульяновский, д. 5 к. 183, 644702",1748,Vraagt
1118778972905,"Kelly, Rivera and Wood","к. Воскресенск, бул. Озерный, д. 516 стр. 29, 653440",411,
1202563701570,Petersen-Lee,"клх Павловская, наб. Красная, д. 8/1, 921150",1827,Controleren
1144809625740,"Vincent, Kramer and Shah","п. Кажим, пр. Высоцкого, д. 50 стр. 88, 494313",384,Verkeerde
5101884788506,"Rodriguez, Cobb and Holder","с. Гремячинск (Перм.), пр. Краснознаменный, д. 5 стр. 5, 670951",2354,
5177343950130,Carter-Lewis,"г. Нягань, ш. Ивановское, д. 9/2 стр. 725, 802000",1914,
5087813786110,Dyer-Clark,"д. Пушкин, пр. Городской, д. 2 стр. 3, 606589",1762,Ofzo
1216622856075,"Combs, Johnson and Cook","к. Ульяновск, пр. Плеханова, д. 10 стр. 5/8, 242608",2101,Wanhopig
5151280675948,Perry-Ward,"клх Асино, ш. Вахитова, д. 26 к. 103, 658785",1351,
5213260385245,Jensen LLC,"п. Черемхово, пр. Щетинкина, д. 8/6 к. 19, 610428",2338,
1059249368210,Brooks Inc,"к. Кулунда, пер. Путейский, д. 2 стр. 596, 617798",1018,Behandelen
5115080179649,Velasquez Group,"г. Туруханск, бул. Широкий, д. 7, 440608",2479,Geweldige
5192113688950,Shaw-Wood,"п. Луга, ш. Шахтерское, д. 50 к. 15, 830166",387,
5107547154501,"Edwards, Mitchell and Ferguson","п. Кировск (Мурм.), ул. Тургенева, д. 2, 198517",2073,
1150879096500,"Benitez, Robinson and Lewis","клх Суздаль, бул. 50 лет Октября, д. 655 к. 3/8, 544282",933,
5175108910136,Stewart Ltd,"п. Мончегорск, наб. Лазо, д. 392 к. 5/2, 616836",926,Rest
1171111563666,Andrews-Duncan,"ст. Бомнак, алл. Ярославская, д. 5, 269401",83,
5060439238921,"Sawyer, Saunders and Evans","ст. Белый Яр (Томск.), бул. Ольховый, д. 247 к. 2, 968040",2256,Schuur
5094351348890,Rojas-Hicks,"п. Калевала, алл. Бригадная, д. 9, 246704",114,Mannetje
1200158024593,Byrd PLC,"д. Рыбинск, пр. Весенний, д. 376, 688726",2600,
1090457708615,Hardin Inc,"клх Яшкуль, алл. Аэродромная, д. 684 к. 27, 316062",159,Voorkant
5073399202157,Zuniga LLC,"клх Шахты, наб. Отрадная, д. 517 стр. 6, 458477",838,
5066365301536,"Lopez, Acosta and Baker","к. Арзамас, ш. Кошевого, д. 1/1 стр. 422, 440355",2770,Plassen
5101849758720,Garza Group,"к. Карталы, наб. Краснознаменная, д. 3 к. 84, 872324",1953,
5196715292978,Duran-Romero,"к. Южно-Курильск, пер. Стахановский, д. 95 стр. 13, 260184",929,
5177123711100,Bowen-Williams,"ст. Пушкино (Моск.), ул. Брянская, д. 99 стр. 9/5, 914690",250,Lacht
1011830146327,Hampton-Edwards,"с. Верхоянск, пер. Ломоносова, д. 1/4 к. 48, 571486",298,
5013189729152,Coleman-Bartlett,"с. Усинск, пр. Демьяна Бедного, д. 520 к. 514, 123639",1842,Geloven
5030425881162,"Willis, Barker and Cummings","ст. Смирных, алл. Машиностроителей, д. 191 стр. 85, 883922",2404,Uitgaan
1030880755620,"Garcia, Jackson and Torres","д. Мыс Шмидта, бул. Коммуны, д. 1 стр. 4, 353492",153,
5125815568753,Whitehead-Jones,"с. Кущевская, ш. Маяковского, д. 986 стр. 2, 753566",463,
5031190682628,"Perez, Murphy and Manning","клх Гусь-Хрустальный, пер. Балтийский, д. 8/1, 742138",1760,Zelf
1227589587191,"Gonzales, Jones and Peterson","ст. Люберцы, ш. Кубанское, д. 51 стр. 8, 671686",2972,Keren
5172444772407,"Diaz, Snyder and Walters","клх Саратов, наб. Иркутская, д. 7 к. 8, 747006",2252,
1114081226819,Willis Ltd,"г. Волгоград, бул. Полевой, д. 264, 921217",2153,Mannetje
1143971384072,"Hart, Thomas and Morgan","клх Адлер, бул. Нахимова, д. 85, 937352",1022,
5180759349623,Williams Inc,"к. Северобайкальск, пр. Линейный, д. 1/9 к. 90, 401056",2012,Betaald
5071033116952,Richardson LLC,"п. Каменск-Уральский, пр. Саратовский, д. 465, 699709",162,
5080203648432,Walsh Group,"клх Невьянск, ш. Алтайское, д. 45 стр. 5, 073144",1218,
1086985018647,Brown LLC,"г. Кабанск, пр. 30 лет Победы, д. 6 стр. 490, 189970",1198,
1181242591408,"Reid, Lopez and Watson","с. Мурманск, ул. Серафимовича, д. 15 стр. 3, 712243",1083,Terugbrengen
1102287771794,Rivas and Sons,"ст. Лагань, пр. Маркса Карла, д. 1/1, 474120",1015,Gespannen
5208366692331,"Golden, Hays and Carter","д. Североморск, наб. Кедровая, д. 4, 916783",89,Rekeningen
5183061763594,Jones-Stout,"г. Объячево, ул. Мичурина, д. 234 стр. 1/9, 505177",2251,Moeten
5146198941268,Foster and Sons,"п. Лодейное Поле, ул. Минская, д. 4/2 стр. 367, 598443",1475,
1221599104836,Horne LLC,"ст. Шали, алл. Пархоменко, д. 36 стр. 4/5, 134650",1636,Verwacht
5055104227426,Mullen-Garcia,"д. Адыгейск, алл. Иванова, д. 650 к. 7/4, 176226",165,Steek
5211909337790,Martinez-Martinez,"с. Белогорск (Амур.), ул. Тополиная, д. 74, 325342",1139,
1204584710659,Andersen LLC,"д. Подольск, наб. 9 Января, д. 700, 758355",2542,
5215792951644,Aguilar-Joseph,"п. Городовиковск, пр. Цветочный, д. 9, 048863",1416,Verzekerd
1226652252760,"Mercado, Jones and Mcbride","п. Ведено, ул. Шаумяна, д. 6/1, 643454",135,Bell
1163026011620,Clark Ltd,"с. Певек, пр. Строителей, д. 45, 161522",711,
1068231071721,Watson-Molina,"г. Богучар, наб. Каштановая, д. 1, 092195",872,
5061492673424,"Lewis, Lara and Powell","клх Павловская, алл. Томская, д. 1 к. 1, 239616",2730,
1014191487243,Jenkins Group,"с. Нижний Новгород, пер. Монтажников, д. 5/5, 061749",957,
5025882040620,Fernandez-Bernard,"клх Старая Русса, пр. Красногвардейский, д. 81 стр. 659, 704404",2738,Alarm
5227543465683,Lloyd-Obrien,"п. Шатой, алл. Сплавная, д. 8 стр. 5, 314846",255,Schilderij
5077626224055,Nguyen LLC,"к. Избербаш, алл. Серова, д. 50 к. 871, 991234",500,
5217600444892,"Fox, Moreno and Krause","п. Углич, бул. Механизаторов, д. 8/5 стр. 3/6, 205445",781,
5216974616524,Martin-Silva,"г. Верхнее Пенжино, пер. Кедровый, д. 9 стр. 8, 014151",1238,Bodem
5127495604814,"Middleton, Adams and Sanders","п. Волгоград, наб. Жуковского, д. 4, 940118",1504,Gestuurd
1157495781959,Salinas LLC,"ст. Омск, пр. Городской, д. 8, 411097",1053,
5062131052980,Jones LLC,"д. Томпа, ш. Большое, д. 476, 144215",2651,
5037229193766,Vaughn Ltd,"ст. Крымск, ш. Студенческое, д. 94 стр. 7, 360818",2675,
5148156099823,Livingston-Rice,"с. Рыбинск, ш. Пархоменко, д. 6/1 стр. 809, 307292",713,Walker
5183450676404,"Graves, Rhodes and Stewart","п. Сосновый Бор, ул. Байкальская, д. 690 к. 474, 111821",441,
1103697097536,"Mendoza, Wagner and Ortiz","ст. Советский, алл. Славянская, д. 5/6 стр. 93, 787698",674,Carlos
1211550903882,Schwartz-Wolfe,"п. Ростов, ул. Карбышева, д. 3/5 к. 1, 392114",2107,Uwe
5221395560425,Harper Inc,"с. Избербаш, ш. Калинина, д. 1/9 стр. 1/1, 856422",1949,Feestje
5126451898865,"Morse, Jones and Hart","ст. Тутончаны, пр. Пригородный, д. 811 к. 5/4, 708026",513,
5067544993863,Anthony PLC,"к. Магас, ш. Тульское, д. 79 стр. 37, 399042",1669,Foto'S
1090790297124,"Gilbert, Campbell and York","ст. Псков, пер. Сплавный, д. 91 к. 64, 796015",1404,Rekeningen
1170864765807,Bell-Holland,"п. Бирск, пр. Иванова, д. 2 стр. 7/4, 067734",383,Opeten
1034950789565,"Dean, Munoz and Smith","п. Сухиничи, наб. Полевая, д. 6, 583786",2875,
5211296654245,House-Moses,"ст. Лянтор, ул. Почтовая, д. 7, 139889",597,Bestand
1054352703833,Fry-Brown,"п. Онега, ш. Пушкинское, д. 569, 461310",35,Moordenaar
1017846329577,Fields-Jones,"ст. Приозерск, наб. Ермака, д. 737 к. 4, 557974",874,Leger
1177244866369,"Manning, Perez and Robinson","г. Усолье Сибирское, бул. Гражданский, д. 8/5 стр. 45, 450962",1051,
1164390096287,"Vargas, Graves and Rodriguez","с. Глазов, ул. Карьерная, д. 29, 442585",2602,
5028736582628,"Richmond, Griffin and Perez","к. Ставрополь, пер. Мелиораторов, д. 60 стр. 514, 392368",899,
1098049765990,Williams-Chen,"ст. Чокурдах, ш. Болотное, д. 133 к. 259, 518181",1302,
5076608651543,Fisher LLC,"к. Вытегра, ш. Привокзальное, д. 4/9 к. 8, 101750",2197,
5183376831094,Jensen-Solomon,"ст. Серов, пер. Камский, д. 63 стр. 617, 494907",2075,Datje
1047720978887,Murphy-Snyder,"г. Новый Уренгой, ш. Ольховое, д. 6 стр. 868, 846626",1010,
1160298352720,Lang-Garcia,"к. Ахтубинск, ш. Строителей, д. 90 стр. 983, 295241",2410,
1228040045364,"Brock, Mann and Johnson","ст. Пятигорск, пер. Радужный, д. 7, 358960",2498,Doorgaat
1093395240190,Hayes Inc,"с. Артем, ул. Л.Толстого, д. 7/3, 443826",144,Bezittingen
1057038027287,"Clark, Zhang and Hernandez","г. Кизилюрт, ул. Гражданская, д. 48 стр. 7/1, 591870",319,
5032632729575,White-Pearson,"ст. Грозный, бул. Просторный, д. 539 к. 2, 350916",1811,Acties
1206837644090,Chen-Padilla,"ст. Ревда (Сверд.), ул. Тульская, д. 1 стр. 29, 600801",1149,
5093825182105,Porter-Green,"д. Щелково, пер. Пограничный, д. 6, 866945",2968,Meredith
1183768383292,Smith-Stevens,"п. Снежногорск (Мурм.), пер. Первомайский, д. 5/2 стр. 794, 815309",1428,Bang
5154262010227,Ward-Dillon,"с. Белогорск (Амур.), наб. Тепличная, д. 1 стр. 97, 177178",1209,Arrest
1090937206689,"Thompson, Todd and Myers","г. Котельнич, пер. Пугачева, д. 3 стр. 2/6, 092558",1944,
1015258383865,Shields-Andrews,"ст. Архыз, алл. Олимпийская, д. 497 к. 71, 537306",2836,
5094782920546,Hanna Inc,"п. Талдом, бул. Автомобилистов, д. 4 стр. 5, 119390",2011,Chery
5132609450045,Walters and Sons,"г. Мончегорск, наб. Леваневского, д. 7/8, 442011",584,Vlug
5068098988139,Hester Inc,"к. Чехов, ул. Красная, д. 9, 744439",2616,
5023345599503,Herrera Group,"г. Северо-Курильск, наб. Южная, д. 431 к. 723, 288838",1455,Opeten
5185382189570,Floyd Inc,"г. Томск, пр. Народный, д. 946, 617133",1727,
1132928587406,Williams Inc,"с. Старая Русса, алл. Журавлева, д. 885, 425972",2097,
5060204135888,Wilson Ltd,"с. Артем, наб. Ленинградская, д. 89, 696361",1545,Kreeg
5054497781938,Wagner-Lindsey,"г. Стрежевой, бул. Лермонтова, д. 395 к. 71, 504579",1865,
1127717009782,Charles-Clarke,"д. Стрежевой, бул. Геологов, д. 817, 918675",1943,Rose
5128126782031,Jackson LLC,"к. Курган, пр. Литейный, д. 93 к. 7, 639574",2489,
1011761682635,Welch Group,"ст. Бологое, пр. Загородный, д. 8/9 к. 515, 117985",1902,Drinkt
5062819246640,"Frost, Martinez and Duran","клх Ямбург, ул. Демьяна Бедного, д. 8, 061538",760,
5142575665469,Rodriguez Ltd,"д. Красная Поляна, алл. Заречная, д. 88 к. 1, 759202",2240,Uwe
1205434235401,"Lawrence, Marshall and Freeman","с. Усть-Баргузин, бул. Отрадный, д. 6 к. 256, 840262",2837,Aanraken
5077979148561,Mullen-Young,"с. Новомосковск, ш. Садовое, д. 37, 417132",1035,
5098600199990,Long and Sons,"с. Змеиногорск, ш. Ватутина, д. 47 стр. 4, 802388",2072,
5043109768301,"Reed, Meyer and Russell","с. Клин, пр. Воровского, д. 7/9 к. 9, 174131",458,
5173006509341,"Meyer, Baxter and Cannon","с. Биробиджан, ш. Космонавтов, д. 9/4 к. 71, 089951",1702,Schok
1146441681770,Coleman-Mclean,"с. Елец, ш. Инженерное, д. 6/5 к. 6/5, 163039",1613,Geslapen
1122840898696,"Ballard, Thompson and Norris","ст. Стерлитамак, пр. Большой, д. 403 к. 543, 216081",2227,Bericht
5081125794020,Bird-Dougherty,"к. Лагань, алл. Кутузова, д. 404, 196374",205,
5097377781177,Torres and Sons,"клх Можга, пер. Химиков, д. 2/3 к. 52, 925172",1324,Binnen
1203431950028,Brown Group,"г. Краснокамск, пр. Бульварный, д. 803 стр. 38, 695247",406,Genezen
1106561742671,"Erickson, Tran and Key","к. Переславль-Залесский, пр. Угольный, д. 1/3 стр. 6/3, 882416",2415,
5157751320590,Mcgee-Gibson,"п. Москва, МГУ, пр. Малиновый, д. 8 к. 57, 842672",2962,
1127291645557,Wheeler-Fuentes,"п. Алапаевск, наб. Мира, д. 266 к. 65, 417392",268,
5041365054946,Thomas Ltd,"д. Усть-Камчатск, бул. Нахимова, д. 89 к. 77, 278275",422,Dikke
5100919426340,"Wells, Harrison and Smith","г. Рубцовск, ул. Ягодная, д. 19 к. 2/6, 684606",194,
1216158173076,"Lyons, Little and Eaton","клх Петропавловск-Камчатский, алл. Баумана, д. 74 к. 17, 701039",219,Opeten
5201987870739,Kelley-Smith,"клх Забайкальск, пер. Гагарина, д. 60, 292447",1331,Levende
1057210532521,Jimenez and Sons,"п. Ялуторовск, пер. Портовый, д. 9 стр. 3, 789798",512,Ofzo
1174818713871,"Wilson, Diaz and Shepherd","г. Макаров, ш. 30 лет Победы, д. 3 стр. 1, 137006",442,Sta
5146733978980,"Williams, Morris and Miller","клх Верхний Баскунчак, ш. Проточное, д. 8 стр. 70, 953626",2582,Egypte
5183649284495,Burnett-Stafford,"п. Наро-Фоминск, ул. Азина, д. 310 к. 72, 528376",839,Jaguar
1040335165793,Griffith-Mills,"клх Тихвин, пр. Пожарского, д. 82 к. 35, 934113",409,
1098827749393,"Henderson, Bennett and Cooper","клх Тырныауз, пер. Новоселов, д. 73 к. 95, 115190",616,Huisje
1188984111854,Pena-Martin,"д. Можайск, ул. 1 Мая, д. 77, 393621",2032,Zeg
5137288465562,Skinner Group,"г. Агинское (Забайк.), наб. Запорожская, д. 4 к. 473, 479753",2381,
5217426958975,"Edwards, Mullins and Murphy","к. Североморск, ул. Моховая, д. 61, 404664",1703,Seconde
1147841308977,Nunez Group,"ст. Азов (Рост.), ш. Чернышевского, д. 2, 741569",1522,
5203432802128,"Wright, Snyder and Henderson","д. Сыктывкар, ш. Чехова, д. 66, 589510",1033,
1154808857048,James PLC,"к. Карабулак, бул. Жданова, д. 7, 083017",2576,Vluchten
