5045427103068,Wilson Group,"к. Сосновый Бор, пр. 50 лет ВЛКСМ, д. 7 стр. 20, 635533",1102,Wegwezen
5212337750851,"Richardson, Moore and Smith","к. Палана, ул. Пархоменко, д. 6/4, 127127",1696,
1027042989115,Gonzalez-Cooper,"г. Баксан, алл. Рабочая, д. 345 стр. 5, 261050",2860,Amerikanen
5195946498864,Morgan-Patel,"с. Москва, пер. Трактовый, д. 5/5 стр. 441, 886680",169,Spider
1186858065954,Ayers-Calderon,"п. Нефтекамск, пер. Совхозный, д. 3 стр. 143, 717829",822,Stan
5073619003871,Choi-Murray,"с. Голицыно, пр. Курганный, д. 7/5 к. 397, 372706",1530,
1156790912409,Garza-Fernandez,"п. Ишим, ш. Ленское, д. 961 к. 71, 223542",373,
1178903929808,Rogers LLC,"ст. Ставрополь, ул. Ломоносова, д. 1/6 стр. 5/8, 882290",701,Voorgesteld
1054661226091,Rodriguez LLC,"клх Игнашино, бул. Бажова, д. 9 к. 23, 601605",2538,
5096559684656,Vasquez-Newman,"ст. Буйнакск, наб. Поселковая, д. 761 стр. 4, 869047",2325,
1110492804531,Tyler-Walker,"к. Казань, ш. Красноярское, д. 634, 241737",1635,
1162432328552,"Wise, Garcia and Anderson","п. Курган, пер. Огородный, д. 789, 417008",1580,
1167325908716,Roach Group,"с. Нефтеюганск, ш. Интернациональное, д. 25 к. 12, 590412",1466,
5090328177693,Farmer Group,"к. Арзамас, бул. Линейный, д. 58 стр. 9/5, 384108",2506,Gat
5028330344125,Brock-Holland,"д. Долинск, пр. Азовский, д. 72, 862162",1706,
5146797697514,Flores and Sons,"г. Фатеж, наб. Иркутская, д. 768 стр. 85, 493421",816,Vette
1186538556379,Terrell-Ortiz,"г. Тотьма, ул. Бригадная, д. 2 к. 8, 937937",2106,
1049125510862,Santos-Hale,"клх Лысьва, бул. Донской, д. 588 к. 84, 607394",213,
1214479584945,Franklin-Weaver,"г. Железногорск(Курск.), ш. Кооперативное, д. 7, 268888",2004,Egypte
1105383972913,"Gordon, Cherry and Case","п. Усть-Катав, пр. Ушакова, д. 5 к. 35, 613345",1758,Woensdag
1173398343535,Robles and Sons,"клх Старый Оскол, ш. 30 лет Победы, д. 2, 954520",875,
1043572004442,"Webster, Novak and Kelley","с. Лагань, бул. Ленинградский, д. 67 стр. 313, 514962",2626,Achtervolgen
1013761333486,Harper PLC,"п. Кызыл, бул. Грибоедова, д. 6/2 к. 7/8, 033967",2142,
5017684037718,Wallace-Smith,"г. Сургут (Хант.), ул. Кирова, д. 4 к. 423, 303426",1875,
5010197102141,"Santos, Moore and Quinn","клх Шадринск, наб. Лесная, д. 984 к. 657, 419074",998,
5183151421240,"Newton, Norris and Ingram","ст. Кунгур, ул. Гастелло, д. 2 к. 97, 415655",806,Vriendin
1198872602004,Deleon Group,"клх Оймякон, бул. Розы Люксембург, д. 13, 326684",1420,Waarheen
5030557140906,Ramirez-Carey,"д. Мирный, бул. Тихий, д. 7 к. 1/2, 752626",1675,Treffen
1134499225024,"Mclaughlin, Perez and Nelson","к. Яр-Сале, наб. Баумана, д. 283 стр. 4/6, 258990",2525,Alhoewel
5066874884820,Hall-Maddox,"г. Асбест, ш. Магистральное, д. 81 к. 6, 619511",2259,
1218661611772,Holt LLC,"п. Усмань, пр. Харьковский, д. 303 к. 688, 041840",1558,
5105756973944,"Lane, Montgomery and James","д. Палана, ул. Кошевого, д. 488, 389214",2127,Grijp
1133925866250,Rodriguez Group,"к. Тимашевск, пер. Комсомольский, д. 4, 413407",327,
5199197238807,Marshall Group,"с. Гремячинск (Бурят.), наб. Максима Горького, д. 83 к. 157, 182081",2190,Keek
1163379860049,"Joyce, Olson and Waters","п. Омск, ш. Черноморское, д. 9 стр. 6/2, 328545",1744,
1176885942749,Downs-Burns,"к. Цимлянск, бул. Мельничный, д. 38 стр. 9/5, 555811",787,Optie
1195374060914,Ryan Inc,"с. Ишим, пер. Виноградный, д. 9/3 к. 6, 752823",74,
1055845805729,Stokes-Erickson,"г. Котельнич, алл. ДОС, д. 59 к. 3/7, 217545",775,
1162738492531,"Anderson, Jordan and Ortiz","п. Анива, пр. Мелиораторов, д. 3 стр. 6, 874379",1381,Opties
1045727125542,Johnson Inc,"ст. Кетченеры, алл. Невского, д. 7 стр. 12, 013365",977,Vanzelf
5131358511917,Stevens-Swanson,"клх Ханты-Мансийск, алл. Коммунальная, д. 385 стр. 8, 284308",2266,Jay
1177216091029,Perez PLC,"ст. Березники, бул. Флотский, д. 842, 628935",2267,
1124365505791,"Ross, Baker and Walton","ст. Череповец, ш. Проточное, д. 9, 115140",504,Italiaanse
1120546562036,Williamson and Sons,"к. Южноуральск, бул. Строительный, д. 80 к. 9, 159517",522,Schilderij
5111873099443,Smith-Jarvis,"клх Пинега, алл. Кольцова, д. 65, 682111",1032,Leugen
1155683150072,Blackwell-Sullivan,"д. Звенигород, ш. Коммунальное, д. 8 к. 33, 861399",2657,
5013655089641,Turner-Howard,"с. Забайкальск, наб. Минская, д. 9/2, 565042",1259,Gangster
5200955769735,Jones Group,"д. Пинега, ш. Дружбы, д. 8 к. 1, 358859",450,
5154964462197,Bates LLC,"г. Калачинск, пр. Прудовой, д. 667, 109543",1298,Rot
5034649384920,"Hernandez, Gregory and Burton","ст. Ревда (Сверд.), ул. Строителей, д. 46, 056136",1106,
1030902163489,Murray Group,"к. Терней, алл. Коллективная, д. 561 к. 5/8, 991575",661,
5025297931060,"Miller, Richmond and Mcmillan","г. Голицыно, алл. О.Кошевого, д. 7/9 к. 7, 029239",2557,
5048907887970,Davis-Conway,"ст. Дагомыс, ш. Мельничное, д. 504, 445547",1154,
5076951540530,Green LLC,"п. Новороссийка, наб. Никитина, д. 2/6 стр. 484, 442909",1062,Zichzelf
1093315182894,Gibbs PLC,"д. Анива, алл. Троицкая, д. 9/1, 055276",1938,
5180877848047,Gibson-Powell,"с. Чайковский, ул. Проточная, д. 28 к. 1/4, 361458",119,Vervelend
1168506154200,Brock PLC,"д. Великий Устюг, ул. Станиславского, д. 2 к. 72, 887577",2915,
1112102217171,Frye Group,"д. Клин, пр. Степной, д. 2 стр. 7, 775872",1927,Ontploffen
5036940721065,Wilson-Melton,"клх Ясный (Оренб.), ш. Седова, д. 94 стр. 123, 432509",2349,Bereiken
5155719472079,Savage Group,"ст. Сыктывкар, бул. Павлика Морозова, д. 448 к. 5/4, 905649",1085,
5074631847824,Rollins Ltd,"д. Невьянск, ш. Приозерное, д. 78 к. 5, 488042",1328,Dagen
1063575549069,Gill Inc,"с. Ноябрьск, наб. Загородная, д. 4/8 стр. 8, 499920",1503,
5206389983730,"Green, Ferguson and Hester","с. Сочи, алл. Крайняя, д. 809, 271051",580,
1047274163100,Holland-Bryan,"с. Невельск, ул. Суворова, д. 1/3, 676654",2754,Taal
5073071575990,Hamilton-West,"п. Волгодонск, бул. Рыбацкий, д. 116 стр. 403, 098751",1551,Kroon
5125226136932,"Grant, Estrada and Ross","ст. Кетченеры, пр. Железнодорожный, д. 7 стр. 9/9, 016146",2091,Gedachte
1036947732898,Nichols PLC,"д. Агинское (Забайк.), наб. Разина, д. 82 к. 72, 382107",232,
1192435210110,Clark-King,"с. Невельск, ул. Спартака, д. 335 к. 32, 444270",2100,Plan
5210723834789,Harrison Group,"г. Самара, ул. Промышленная, д. 480, 103927",559,Pakken
1050289222257,Ryan-Gilmore,"ст. Обнинск, алл. Карла Маркса, д. 3/8 к. 562, 386031",1989,
5051328159328,"Herring, Ramirez and Murphy","ст. Новая Игирма, наб. Революции, д. 460, 580166",1878,
1184404423400,Brooks-Woodard,"ст. Мыс Шмидта, алл. 40 лет Октября, д. 1/7, 098062",2467,
1228539331008,James-Knapp,"с. Губаха, ул. Фурманова, д. 87 к. 5, 326649",2604,
1135746741844,Bailey Ltd,"к. Кизел, ш. Российское, д. 89, 200116",2136,Raadsel
5093355063082,"Knight, Hale and Osborn","г. Забайкальск, пр. Запрудный, д. 2/8, 279014",2553,
1152516065789,"Perry, Anderson and Wheeler","п. Миасс, бул. Рылеева, д. 963 стр. 1/8, 921897",542,Walker
5017888658827,Olson Inc,"ст. Рыльск, ш. Абрикосовое, д. 44, 413321",722,Geslagen
5080551082959,Rodriguez Inc,"п. Тихвин, наб. Западная, д. 874, 706783",866,
5161093508461,"Campbell, Ward and Murray","ст. Усть-Джегута, пр. Кубанский, д. 27, 632828",2152,Schatje
5081830858522,Harmon-Norris,"клх Видное, ш. Курганное, д. 29 стр. 4, 573452",2731,
5035290969302,Oconnor-Johnson,"п. Петушки, алл. Макарова, д. 3, 712263",1959,
1154300383335,Kennedy PLC,"п. Ногинск (Моск.), алл. 9 мая, д. 7 стр. 5/2, 176496",2683,Minstens
5162720287747,"Nielsen, Price and Phillips","п. Нарым, алл. Металлургов, д. 4/3 стр. 336, 545613",2957,Bied
5078962380371,"Ferrell, Bautista and Jones","д. Колпашево, наб. Ульяновская, д. 9 к. 56, 601668",1575,
5142794474565,"Hudson, Parsons and Williams","ст. Нягань, алл. Саратовская, д. 3/1 к. 97, 390738",2587,
5182262647640,"Taylor, Cooper and Smith","клх Рубцовск, бул. Санаторный, д. 937 стр. 2/1, 476891",1458,
1157014968406,Miller-Lee,"к. Саянск, ул. Дорожная, д. 642 к. 1/3, 734231",2211,Mars
1220727556940,"Anderson, Tran and Davis","с. Сальск, ш. Фурманова, д. 2, 198092",1269,Ofwel
5223631121885,Curry-Jones,"к. Северобайкальск, бул. Калужский, д. 9 к. 134, 663855",2791,Loog
1217740583301,House-Kelly,"ст. Балашиха, наб. Веселая, д. 75 к. 6, 395511",2481,
1227357481174,Mccoy-Jenkins,"клх Кетченеры, пер. Братский, д. 4 стр. 3, 044249",2233,Speciaal
5169290083463,"Collins, Smith and Williams","д. Лагань, пер. Амурский, д. 16, 221446",791,Karen
1225657817538,Johnson Inc,"д. Диксон, алл. Высоковольтная, д. 3 к. 96, 199545",2736,Bracht
1171539082054,Gillespie Group,"ст. Новый Уренгой, ш. Вольное, д. 951 к. 7/1, 274519",1754,Washington
1182098055941,Whitney and Sons,"п. Калининград, ул. К.Маркса, д. 4, 251407",1000,
5024411111137,"Tucker, Wolf and Terry","п. Чермоз, ул. Солнечная, д. 57 стр. 76, 090673",2019,Geslagen
1181542848794,Kent Group,"с. Красноуфимск, пер. Учительский, д. 355 к. 833, 061427",2014,
1203327387152,"Wall, Lee and Perez","ст. Беслан, алл. Маяковского, д. 1 к. 5/6, 937169",2236,Geweten
1060740964217,"Willis, Cummings and Fuller","с. Середниково, алл. Герцена, д. 418 к. 6/8, 581126",2185,
1091940078856,Smith-Pace,"клх Сортавала, пер. Хвойный, д. 68, 521425",2215,
5166418098314,Wilson-Hardin,"к. Тымовское, алл. Тамбовская, д. 70 к. 6/2, 732297",2550,
1226896992046,"Thompson, Perez and Ballard","клх Слюдянка, бул. Безымянный, д. 2 к. 5/1, 396306",1100,
5196554259490,"Hooper, Owens and Rivas","клх Лянтор, наб. Беляева, д. 1, 019706",215,
1126797438503,"Palmer, King and Rodriguez","с. Александровск, ш. Шолохова, д. 286, 832834",1514,Elliot
1084526274216,Smith Group,"д. Троицк (Моск.), алл. 60 лет СССР, д. 7/2 стр. 3, 146676",1936,Beste
1130123971867,Dunn and Sons,"к. Усть-Баргузин, алл. Толбухина, д. 71 стр. 63, 732165",495,Prijzen
5165974275352,"Golden, Riddle and Thompson","д. Петрозаводск, ш. Нагорное, д. 48 к. 6, 483051",2303,
1159260240809,Berry-Durham,"г. Галич, ш. Школьное, д. 5/7 стр. 213, 686906",62,
5205486092774,Rodriguez Inc,"клх Нижний Новгород, бул. Космический, д. 40, 238029",141,Fearless
1138944502531,Wallace Group,"к. Геленджик, бул. Макарова, д. 211 стр. 515, 207401",914,Uiteindelijk
5033908326832,Gill and Sons,"г. Нижний Новгород, ш. Суворова, д. 3/8, 876754",2370,Bezwaar
1053838165590,"Sawyer, Schultz and Ramsey","г. Тырныауз, наб. Стахановская, д. 5, 011477",577,Spuit
5138435235550,Chavez LLC,"ст. Омск, наб. Гагарина, д. 39 к. 3, 106759",1235,
1062841893070,Wilson PLC,"г. Югорск, бул. Болотный, д. 1, 686385",1502,
5192272531039,"Allen, Perez and Summers","г. Осташков, наб. Космонавтов, д. 6/6 к. 478, 429309",796,
1116867636698,Hicks-Jones,"ст. Нефтеюганск, наб. Пролетарская, д. 4/2 к. 48, 780955",1786,
1221466817890,Collins Ltd,"ст. Одинцово, пр. Запрудный, д. 9, 133056",2610,Plicht
1033610623463,Gaines-Campbell,"д. Середниково, пер. Спортивный, д. 53 стр. 4/2, 061817",1733,
5115503209014,Hughes-Rodriguez,"г. Нерчинск, бул. Буденного, д. 872, 715856",2031,
5024486709539,Williams-Ortiz,"к. Лабинск, ул. Революционная, д. 6/6 к. 31, 693223",773,Ryan
5057171852293,Rose-Johnston,"д. Переславль-Залесский, ш. Волгоградское, д. 617 стр. 65, 518190",1994,
1105087091119,Bray and Sons,"клх Курумкан, ш. Красных Партизан, д. 31 к. 5/7, 880133",569,
1087690935397,Lewis-Fitzgerald,"г. Ступино, бул. Севастопольский, д. 450, 423777",1588,
5166397726149,Hill Ltd,"с. Уфа, алл. Дальняя, д. 9/1, 073108",1166,
5015635192458,"Lee, Dixon and Young","д. Сургут (Хант.), алл. Глинки, д. 64 к. 981, 152970",227,Genezen
5161041239882,Cochran-White,"с. Екатеринбург, наб. Труда, д. 142, 241680",1133,
5173098896526,Flynn LLC,"п. Ахтубинск, наб. Ростовская, д. 941 к. 62, 449472",2852,Vraagt
5042559684195,"Reid, Lee and Marquez","с. Майкоп, ул. Московская, д. 235 стр. 44, 456848",783,
5135381471660,Nichols-Barrett,"ст. Славянск-на-Кубани, пр. Вишневый, д. 84 стр. 3, 368559",1528,
5129241237450,Parrish Ltd,"с. Сальск, ш. Шоссейное, д. 6/9 стр. 5/9, 507631",282,
1085665350616,Cervantes-Hawkins,"д. Пенза, ул. Революции, д. 3/9 к. 1, 548773",790,
5227366173502,Perez Group,"с. Брянск, алл. Пионерская, д. 34 к. 415, 509858",207,Alhoewel
1167896482753,Scott Inc,"п. Карпинск, наб. Дзержинского, д. 1/7 к. 351, 684550",832,Levende
1085445023795,"Hodge, Gill and Mendez","п. Гусь-Хрустальный, алл. Коммунистическая, д. 8/3 стр. 6/7, 992452",2597,
1142995752250,"Thompson, Padilla and Zavala","д. Сасово, ул. Вокзальная, д. 81, 178598",930,Spring
5137391822255,"Carrillo, Robinson and Hughes","ст. Неплюевка, ул. Ягодная, д. 9 стр. 6, 545837",2417,Nummers
1094248560163,Kemp-Williams,"г. Борзя, пер. Профсоюзный, д. 112, 353423",1679,
5054736732639,"Watts, Dixon and Rhodes","п. Малгобек, пер. Тамбовский, д. 5/3 стр. 9/1, 162685",143,Nationale
5086890588406,Evans PLC,"клх Барнаул, алл. Леваневского, д. 4/9 к. 1/9, 376629",379,Moedig
1038696610809,Miller Group,"клх Тулун, бул. Баумана, д. 3/4, 727765",2711,
1148330896372,"Gonzalez, Allison and Williams","клх Макаров, бул. Садовый, д. 545 стр. 21, 859474",563,Dient
1115016295899,"Dillon, Freeman and Mccoy","г. Рославль, бул. Ломоносова, д. 4 стр. 3/3, 918909",2710,Verbroken
5225854984911,Hudson PLC,"г. Кашира, алл. Карбышева, д. 98 к. 266, 407245",1161,Beschouw
1077599226594,"Dunn, Murray and Wilson","клх Льгов, алл. Серафимовича, д. 30, 026932",2512,
1178925721810,Reid Ltd,"с. Середниково, пр. Новостройка, д. 3/6 к. 76, 252599",279,
1212874682349,Robinson Ltd,"п. Голицыно, алл. Революционная, д. 5/4, 874894",2469,
1057239628841,Gonzalez-Luna,"п. Усть-Кут, алл. Просвещения, д. 461 к. 589, 252052",341,Zwemmen
5160279617086,"Hughes, Moore and Thompson","п. Избербаш, алл. Прохладная, д. 829 стр. 10, 713531",1215,Ruimte
5104243227930,Hernandez Group,"с. Тосно, ул. Марта 8, д. 2/8, 964897",638,
1228414894510,Contreras-Wade,"д. Невельск, пр. Привокзальный, д. 1 к. 6/6, 532459",831,
1093394715028,Watkins Group,"д. Голицыно, пер. Химиков, д. 81 стр. 509, 499800",2289,
1010237729787,"Murphy, Alvarado and Jones","с. Махачкала, бул. Прудный, д. 15 к. 72, 021665",2491,Stuurt
5079176724259,Gomez Inc,"д. Переславль-Залесский, пр. Космический, д. 2/2 к. 9, 480191",2116,Sterven
5011902539688,"Young, Henson and Oliver","клх Чита, алл. Новосельская, д. 159, 803038",520,Vlug
5165392195150,Vega-Moyer,"клх Мезень, бул. Центральный, д. 5/8, 858893",157,
5081039151991,"Johnson, Thompson and Larsen","ст. Сусуман, ш. Победы, д. 9 к. 7/4, 615235",1104,Verkocht
1100977748398,"Mccarthy, Jackson and Lowe","ст. Медногорск, алл. Кедровая, д. 3 к. 43, 097674",244,Slag
1191576117193,"Dean, Smith and Nunez","п. Оха, пер. Высотный, д. 2/1 к. 1/3, 763631",292,Audrey
1026883386496,Brown-Johnson,"с. Рубцовск, ул. Киевская, д. 146, 946104",636,Generaal
1040741566975,Wise-Mcneil,"с. Гатчина, ш. Попова, д. 3 стр. 86, 010791",1054,Gaven
1027812851065,"Peterson, Alvarez and Sanders","г. Соль-Илецк, пер. Уральский, д. 9/3 к. 54, 533887",1946,
5143495268417,"Stewart, Navarro and Bush","ст. Ачхой Мартан, наб. Пушкина, д. 4/9 стр. 9/9, 547933",1955,
1120276150961,Smith Group,"г. Кош-Агач, пер. Омский, д. 9, 262460",2375,
5088412085834,Rush-Stanton,"д. Троицк (Моск.), бул. Васильковый, д. 93 к. 667, 606532",776,
5217132498589,"Mendoza, Arias and Petty","клх Холмск, ул. Береговая, д. 7 к. 569, 267335",2371,
5079051413920,Williams Inc,"г. Бирск, алл. Западная, д. 89, 698966",2535,
5116659742392,Branch Group,"г. Диксон, бул. Коммунаров, д. 29, 823305",1003,
1045586390200,Nichols-Torres,"д. Павловский Посад, наб. Главная, д. 71 стр. 762, 359632",850,
1104934070416,Hogan-Larson,"ст. Инта, наб. Орловская, д. 665, 316554",1426,
5025612983127,Garcia-Miller,"ст. Заводоуковск, ул. Запрудная, д. 48 стр. 6, 716931",1924,
1187520809552,"Wilkinson, Reynolds and Castro","д. Каспийск, ш. Свободы, д. 478 стр. 9/8, 481399",136,Vette
1182145359175,"Deleon, Henderson and Garcia","к. Батайск, наб. Дальняя, д. 933 к. 429, 934629",740,
5085942864838,"Carter, Evans and Blake","ст. Шилка, ул. Комарова, д. 6/1, 622618",471,
5027746466721,"Gentry, Fox and Thompson","д. Стерлитамак, бул. Шаумяна, д. 538, 216977",2874,
1228719850040,Stewart Ltd,"ст. Октябрьское (Хант.), наб. Томская, д. 7/6, 765149",419,Toespraak
5222192419488,Richardson and Sons,"с. Псков, алл. Раздольная, д. 511 к. 4/2, 691970",192,
1148050618220,Henry-Craig,"клх Рубцовск, пер. Космонавтов, д. 22 к. 13, 458794",2138,
1152418950639,Gamble LLC,"г. Истра, ш. Ореховое, д. 3 к. 3, 006257",2618,
5117901333303,"Guerrero, Franklin and Brown","клх Кизляр, алл. Ягодная, д. 9, 704054",440,
1017703966598,"Carter, Edwards and Payne","с. Горно-Алтайск, пер. Светлый, д. 10 стр. 9, 564396",2316,Herinneringen
1064740828790,Murray-Brown,"п. Уварово, алл. Путейская, д. 9/9 стр. 282, 258655",2057,
1223483577646,"Robertson, Williams and Roberts","п. Усть-Катав, алл. Социалистическая, д. 6 к. 7/5, 401781",2613,Sterven
1207806024029,Weiss-Thompson,"п. Новомосковск, пер. Короленко, д. 28 к. 3/5, 699801",2904,
5208553727938,Lee LLC,"с. Касимов, ул. Энгельса, д. 589, 373022",214,
5132575674270,"Mckay, Turner and Boyd","с. Соль-Илецк, пер. Герцена, д. 8/7, 998750",334,
1054148537893,Smith-Walter,"п. Тихорецк, алл. Крымская, д. 30, 348017",925,
1027304284920,Parks and Sons,"клх Норильск, ш. Луговое, д. 90, 095859",2081,
1012162644966,Farrell Inc,"клх Иваново, ш. Водопроводное, д. 2 стр. 7, 035709",1622,Idee
5097865729616,"Cantrell, Reyes and Rodriguez","п. Волоколамск, пр. Правды, д. 6 к. 618, 154457",2318,
1023481008187,Lindsey-Clay,"г. Карабулак, наб. Полевая, д. 84 к. 67, 832240",1203,Doorgaat
5172356482469,Thompson Group,"ст. Ельня, пер. Производственный, д. 5, 286837",2037,Leeuw
1056507149852,Bates-Maldonado,"к. Череповец, пр. Нижний, д. 7/8 к. 457, 629469",2871,Ontploffen
5200211098775,Ryan-Brown,"к. Щельяюр, бул. Пожарского, д. 1/3 к. 984, 824457",1968,Avond
1165940747598,Hicks Inc,"д. Щелково, пер. Астраханский, д. 183, 439962",506,
5127659124269,"Hooper, Wheeler and Murphy","с. Ессентуки, наб. Надежды, д. 939, 581102",480,Tenzij
1073841609863,"Kelley, Chandler and Swanson","к. Онега, наб. Выгонная, д. 141 к. 51, 552526",433,
5133869979766,Kim Ltd,"д. Ноглики, бул. Песочный, д. 7, 942976",1587,Hetgeen
1166930551523,"Webb, Guzman and Wilcox","клх Урус-Мартан, пр. Пионерский, д. 8, 372125",2261,
5098859808240,"Walker, Weaver and Alvarado","ст. Суздаль, ул. Кедровая, д. 5, 530752",399,
5177723926969,"Jones, Cohen and Carter","с. Воскресенск, пр. Челюскинцев, д. 6 стр. 841, 640510",2527,Sterven
5029200165957,Boyer PLC,"ст. Буденновск, ш. Гоголя, д. 897 к. 95, 623318",31,Italiaanse
5205699834720,"Curry, Beck and Newman","с. Сосногорск, алл. Высоковольтная, д. 6 стр. 900, 859526",2739,
5083620990460,Williams Group,"г. Яр-Сале, бул. Тополиный, д. 419 стр. 3/3, 274610",1390,
5147152935562,Cross Ltd,"клх Усмань, пр. Транспортный, д. 391, 604017",17,Bekijk
1146060916462,Wood-Long,"ст. Сусуман, пр. Казачий, д. 91, 274582",2921,
5067615798652,"Harrison, Jones and Smith","ст. Ивдель, алл. Челюскинцев, д. 8/4 к. 44, 214719",2203,Witte
1015316967016,"Murphy, Foster and Robertson","г. Куртамыш, ул. Геологов, д. 4, 113707",1253,
1022718984474,Brown-Wang,"ст. Шереметьево, пр. Таманский, д. 142 к. 41, 147215",1226,Netjes
5076609851016,Baker-Harvey,"д. Аршан (Бурят.), наб. Индустриальная, д. 402, 821946",679,Moeilijkheden
5092145394919,"Kim, Dawson and Harrison","клх Петрозаводск, наб. Л.Толстого, д. 1 к. 8/8, 253199",1700,Steeds
1202783302787,"Walker, Beard and Simpson","клх Горячинск, бул. Бульварный, д. 23 к. 99, 783462",70,Lossen
5031525099470,Davis-Johnson,"п. Курчатов, ш. Тимирязева, д. 328 стр. 2, 302980",490,
1194160914837,Mcguire-Barrett,"к. Ясный (Оренб.), ул. Карла Маркса, д. 8 к. 58, 688284",2139,Schatje
5183863026749,Moore-Brown,"г. Кижи, наб. Курортная, д. 1 к. 3, 142930",1231,Monica
1036768905172,Kennedy LLC,"к. Семлячики, алл. ДОС, д. 121 стр. 11, 925818",2954,
5078992360673,Johnson-Neal,"п. Катайск, наб. Владимирская, д. 30, 625074",1956,
1171931550460,Brown-Brown,"с. Переславль-Залесский, наб. Степана Разина, д. 6/6 стр. 993, 460426",2997,
5119237936571,"Lopez, Owens and Ochoa","г. Мыс Шмидта, бул. Станционный, д. 5 стр. 9/1, 173445",836,Staal
1184968433055,"Wells, Cabrera and Frazier","клх Октябрьский (Башк.), алл. 70 лет Октября, д. 872 к. 8/9, 739146",1928,Stelde
1043636343563,"Foley, Banks and Carrillo","д. Ростов, бул. Терешковой, д. 7/9 к. 42, 343283",939,
1065877382340,"Tran, Miller and Morrow","п. Барнаул, ул. Средняя, д. 34 к. 946, 111258",1863,
5228540821218,Kim-Smith,"к. Сухиничи, ул. Урицкого, д. 2/7, 714313",308,
1090464078000,"Kelley, Mccullough and White","клх Петропавловск-Камчатский, пр. Волжский, д. 578 стр. 2/2, 616359",570,Bewijzen
1180839172590,Gibbs-Nelson,"г. Соликамск, ул. Загородная, д. 45 стр. 728, 410511",1790,
